{
  "exportedAt": "2025-11-19T09:58:33.976Z",
  "total": 156,
  "records": [
    {
      "id": "rec04J6bNhLOTj4WH",
      "createdTime": "2025-10-07T15:23:06.000Z",
      "Title": "Addressing human -wildlife conflicts and risks of trade in endangered species through restoration of ecosystems and implementation of Nature-based solutions. ",
      "Organizer/Chair": "Ministry of Ecology, Environmental Protection and Climate Change Ministry of Agriculture FAO-Uzbekistan ICARDA-CAC IUCN",
      "Room ": "Markhor S. (70)",
      "start date": "24/11/2025",
      "Start Time - sort": "2025-11-24T17:00:00.000Z",
      "End": "19:00",
      "Description of the side event": "Presentation of Ramsar National Strategy of Uzbekistan The importance of Ramsar sites for biodiversity and migratory species ",
      "Start": "18:00",
      "Type": [
        "Side event"
      ],
      "Start date - Panamanian date": "24/11/2025",
      "Start time - Panamanian Time": "18:00",
      "Last Modified": "2025-11-11T22:12:35.000Z"
    },
    {
      "id": "rec0I6MWWmJSFjSf4",
      "createdTime": "2025-11-14T17:12:22.000Z",
      "Title": "Bureau Meeting\n",
      "Organizer/Chair": "CoP20 Bureau",
      "Room ": "L. Orchid",
      "start date": "29/11/2025",
      "Start Time - sort": "2025-11-29T16:00:00.000Z",
      "End": "17:30",
      "Start": "17:00",
      "Type": [
        "Other"
      ],
      "Start date - Panamanian date": "29/11/2025",
      "Start time - Panamanian Time": "17:00",
      "Last Modified": "2025-11-14T17:12:35.000Z"
    },
    {
      "id": "rec0VnOnQgORfEQbT",
      "createdTime": "2025-11-19T09:57:09.000Z",
      "Title": "High Level Segment ",
      "Organizer/Chair": "High Level Segment",
      "Room ": "Argali (Com I)",
      "start date": "23/11/2025",
      "Start Time - sort": "2025-11-23T14:00:00.000Z",
      "End": "18:00",
      "Description of the side event": "High Level Segment",
      "Start": "15:00",
      "Type": [
        "Other"
      ],
      "Start date - Panamanian date": "23/11/2025",
      "Start time - Panamanian Time": "15:00",
      "Last Modified": "2025-11-19T09:57:54.000Z"
    },
    {
      "id": "rec0bqsN4a909TjIY",
      "createdTime": "2025-10-07T15:23:06.000Z",
      "Title": "EPI Members meeting",
      "Organizer/Chair": "Co-hosted by the Governments of Angola, Ethiopia, Malawi and Nigeria with the EPI Foundation",
      "Room ": "C.A.Tortoise (40)",
      "start date": "25/11/2025",
      "Start Time - sort": "2025-11-25T11:15:00.000Z",
      "End": "13:45",
      "Description of the side event": "Honorable Sharon Ikeazor invites the representatives of the 26 member states of the Elephant Protection Initiative (EPI) to a closed-door meeting to coordinate policy and strategy on elephant conservation. ",
      "Start": "12:15",
      "Type": [
        "Side event"
      ],
      "Start date - Panamanian date": "25/11/2025",
      "Start time - Panamanian Time": "12:15",
      "Last Modified": "2025-11-07T15:24:04.000Z"
    },
    {
      "id": "rec1DTT2Sp4BjB9wP",
      "createdTime": "2025-10-07T15:23:06.000Z",
      "Title": "Inter-WENs cooperation",
      "Organizer/Chair": "South Asia Wildlife Enforcement Network (SAWEN) with LATF and DNPWC, Nepal",
      "Room ": "Saiga A. (120)",
      "start date": "4/12/2025",
      "Start Time - sort": "2025-12-04T16:15:00.000Z",
      "End": "18:45",
      "Description of the side event": "The event will promote alignment between regional enforcement mechanisms and the CITES framework by exploring opportunities for enhanced inter-WEN collaboration, mutual capacity building, and sustained donor engagement.  ",
      "Start": "17:15",
      "Type": [
        "Side event"
      ],
      "Start date - Panamanian date": "4/12/2025",
      "Start time - Panamanian Time": "17:15",
      "Last Modified": "2025-11-07T15:25:48.000Z"
    },
    {
      "id": "rec1Wr3UAnKferYsW",
      "createdTime": "2025-10-07T15:23:06.000Z",
      "Title": "Data Sharing and IWT",
      "Organizer/Chair": "Fauna & Flora International \nCo-hosted ACBK, Institute of Zoology of UZ, TRAFFIC etc.",
      "Room ": "S.Falcon (70)",
      "start date": "27/11/2025",
      "Start Time - sort": "2025-11-27T11:15:00.000Z",
      "End": "13:45",
      "Description of the side event": "This side event will focus on the importance of data sharing among key ministries and agencies to address illegal wildlife trade (IWT). There are ongoing gaps and challenges to effective law enforcement responses to effectively tackle IWT. A critical one is the paucity of data collection, and limited sharing of existing data between agencies and ministries mandated to address IWT. \n\nThis event will bring together representatives from across the world, including Central Asia, to showcase efforts to develop data sharing mechanisms.  It will look at the wider successes, challenges, and importance of data sharing for effective informed responses to IWT and will draw upon global examples of best practice, to inform and strengthen regional awareness and coordinated responses to IWT, especially in the Central Asian context. ",
      "Start": "12:15",
      "Type": [
        "Side event"
      ],
      "Start date - Panamanian date": "27/11/2025",
      "Start time - Panamanian Time": "12:15",
      "Last Modified": "2025-11-07T15:23:02.000Z"
    },
    {
      "id": "rec29NmpAHKSfKa9h",
      "createdTime": "2025-10-07T15:23:06.000Z",
      "Title": "KHA - Key Herpetological Areas. A new international conservation initiative",
      "Organizer/Chair": "Ministry of Ecology, Environmental Protection and Climate Change of the Republic of Uzbekistan Institute of Zoology of the Academy of Sciences of the Republic of Uzbekistan",
      "Room ": "Caracal (Press)",
      "start date": "26/11/2025",
      "Start Time - sort": "2025-11-26T16:00:00.000Z",
      "End": "18:30",
      "Description of the side event": "KHA - Key Herpetological Areas. A new international conservation initiative ",
      "Start": "17:00",
      "Type": [
        "Side event"
      ],
      "Start date - Panamanian date": "26/11/2025",
      "Start time - Panamanian Time": "17:00",
      "Last Modified": "2025-11-07T15:25:48.000Z"
    },
    {
      "id": "rec2XI4ddSCQ5jAOm",
      "createdTime": "2025-10-07T15:23:06.000Z",
      "Title": "Integrating Habitat Quality into CITES Sustainability Measures",
      "Organizer/Chair": "Ministry of Marine Affairs and Fisheries Republic of Indonesia",
      "Room ": "C.A.Tortoise (40)",
      "start date": "5/12/2025",
      "Start Time - sort": "2025-12-05T11:15:00.000Z",
      "End": "13:45",
      "Description of the side event": "This side event will explore the critical link between international trade, species sustainability, and habitat integrity, aligning with the broader goals of the Kunming–Montreal Global Biodiversity Framework and the growing recognition within CITES of the need for systemic approaches to wildlife trade regulation. ",
      "Start": "12:15",
      "Type": [
        "Side event"
      ],
      "Start date - Panamanian date": "5/12/2025",
      "Start time - Panamanian Time": "12:15",
      "Last Modified": "2025-11-07T15:25:48.000Z"
    },
    {
      "id": "rec2nbsKVps1V3QBm",
      "createdTime": "2025-11-14T12:45:56.000Z",
      "Title": "Midway Press Conference \n",
      "Organizer/Chair": "CITES Secretariat and Uzbekistan\n",
      "Room ": "Caracal (Press)",
      "start date": "29/11/2025",
      "Start Time - sort": "2025-11-29T12:00:00.000Z",
      "End": "14:00",
      "Start": "13:00",
      "Type": [
        "Other"
      ],
      "Start date - Panamanian date": "29/11/2025",
      "Start time - Panamanian Time": "13:00",
      "Last Modified": "2025-11-14T13:42:53.000Z"
    },
    {
      "id": "rec3AGjLdfcuKdqdL",
      "createdTime": "2025-10-07T15:23:06.000Z",
      "Title": "Progress in and tools for implementing CITES for seahorses. ",
      "Organizer/Chair": "IUCN (International Union for Conservation of Nature) - Seahorse, Pipefish & Seadragon Specialist Group",
      "Room ": "Bukahra D. (120)",
      "start date": "29/11/2025",
      "Start Time - sort": "2025-11-29T18:00:00.000Z",
      "End": "20:30",
      "Description of the side event": "Support Parties’ consideration of all seahorse related Decisions being proposed at CoP20, which focus on actions plans, capacity building, monitoring and illegal trade. These draft decisions build upon earlier CITES initiatives aimed at addressing illegal and unsustainable trade in dried seahorses - highlighting a strong shift toward better monitoring, enforcement action, and national-level planning to sustain populations. ",
      "Start": "19:00",
      "Type": [
        "Side event"
      ],
      "Start date - Panamanian date": "29/11/2025",
      "Start time - Panamanian Time": "19:00",
      "Last Modified": "2025-11-07T15:25:48.000Z"
    },
    {
      "id": "rec4Uulf5csLaYMz3",
      "createdTime": "2025-10-07T15:23:06.000Z",
      "Title": "Strengthening Capacity for Widlife Confiscations: Tools, Training, and Field Experience",
      "Organizer/Chair": "International Fund for Animal Welfare (IFAW) and co-hosting countries TBC (Congo, Uganda, Brazil)",
      "Room ": "S.Falcon (70)",
      "start date": "28/11/2025",
      "Start Time - sort": "2025-11-28T16:15:00.000Z",
      "End": "18:45",
      "Description of the side event": "Showcase successful implementation of training and equient use in the Republic of Congo, Uganda, and Brazil. These cases will illustrate the application of tools and resources in diverse enforcement contexts and share lessons learned from implementation. ",
      "Start": "17:15",
      "Type": [
        "Side event"
      ],
      "Start date - Panamanian date": "28/11/2025",
      "Start time - Panamanian Time": "17:15",
      "Last Modified": "2025-11-07T15:25:48.000Z"
    },
    {
      "id": "rec51a3Ntsc742k2D",
      "createdTime": "2025-10-07T15:23:06.000Z",
      "Title": "Siem Reap Declaration",
      "Organizer/Chair": "IUCN. The event is being co-hosted by elephant range states, IUCN secretariat, SSC Asian Elephant Specialist Group, IUCN Commission and international NGOs",
      "Room ": "C.A.Tortoise (40)",
      "start date": "3/12/2025",
      "Start Time - sort": "2025-12-03T11:15:00.000Z",
      "End": "13:45",
      "Description of the side event": "Bring together range States, CITES authorities, intergovernmental agencies, and key conservation stakeholders to present concrete implementation steps taken since the Declaration’s adoption. It will examine how regional cooperation—through transboundary corridors, data sharing, harmonized enforcement and a range range-wide action plan—can be aligned with CITES mandates and mechanisms. ",
      "Start": "12:15",
      "Type": [
        "Side event"
      ],
      "Start date - Panamanian date": "3/12/2025",
      "Start time - Panamanian Time": "12:15",
      "Last Modified": "2025-11-07T15:25:48.000Z"
    },
    {
      "id": "rec54enc6rg1IQpYN",
      "createdTime": "2025-10-31T16:03:14.000Z",
      "Title": "Committee I",
      "Room ": "Argali (Com I)",
      "start date": "25/11/2025",
      "Start Time - sort": "2025-11-25T08:00:00.000Z",
      "End": "12:00",
      "Start": "09:00",
      "Type": [
        "Main mtg"
      ],
      "Start date - Panamanian date": "25/11/2025",
      "Start time - Panamanian Time": "09:00",
      "Last Modified": "2025-11-17T09:29:01.000Z"
    },
    {
      "id": "rec5ZgxC2HuDK7ScV",
      "createdTime": "2025-11-14T17:12:39.000Z",
      "Title": "Bureau Meeting",
      "Organizer/Chair": "CoP20 Bureau",
      "Room ": "L. Orchid",
      "start date": "2/12/2025",
      "Start Time - sort": "2025-12-02T16:00:00.000Z",
      "End": "17:30",
      "Start": "17:00",
      "Type": [
        "Other"
      ],
      "Start date - Panamanian date": "2/12/2025",
      "Start time - Panamanian Time": "17:00",
      "Last Modified": "2025-11-14T17:12:52.000Z"
    },
    {
      "id": "rec5dmLzGhGxEtIVq",
      "createdTime": "2025-10-07T15:23:06.000Z",
      "Title": "Wild Animals Not Pets - Ensuring Responsible Pet Ownership Through Positive Lists in Consumer Markets",
      "Organizer/Chair": "Animal Advocacy and Protection (AAP); co-host Eurogroup for Animals (EfA) ",
      "Room ": "C.A.Tortoise (40)",
      "start date": "29/11/2025",
      "Start Time - sort": "2025-11-29T11:15:00.000Z",
      "End": "13:45",
      "Description of the side event": "Provide concrete policy options for Parties aiming to strengthen species conservation, prevent animal suffering, and protect public health. It also highlights the importance of collaboration between CITES authorities, environmental ministries, veterinary and public health sectors. ",
      "Start": "12:15",
      "Type": [
        "Side event"
      ],
      "Start date - Panamanian date": "29/11/2025",
      "Start time - Panamanian Time": "12:15",
      "Last Modified": "2025-11-07T15:25:48.000Z"
    },
    {
      "id": "rec5wGMMuAQQakn85",
      "createdTime": "2025-10-31T16:08:37.000Z",
      "Title": "Committee I",
      "Room ": "Argali (Com I)",
      "start date": "28/11/2025",
      "Start Time - sort": "2025-11-28T08:00:00.000Z",
      "End": "12:00",
      "Start": "09:00",
      "Type": [
        "Main mtg"
      ],
      "Start date - Panamanian date": "28/11/2025",
      "Start time - Panamanian Time": "09:00",
      "Last Modified": "2025-10-31T16:21:26.000Z"
    },
    {
      "id": "rec61xyDCT2pyJNqZ",
      "createdTime": "2025-10-07T15:23:06.000Z",
      "Title": "WOAH CC",
      "Organizer/Chair": "Singapore",
      "Room ": "C.A.Tortoise (40)",
      "start date": "26/11/2025",
      "Start Time - sort": "2025-11-26T11:15:00.000Z",
      "End": "13:45",
      "Description of the side event": "A key highlight will be the recent designation of National Parks Board Singapore's Centre for Wildlife Forensics as a WOAH Collaborating Centre (CC). We'll discuss the Centre's expertise in wildlife forensics, its role in combating wildlife trafficking, and how this new status enhances international collaboration in wildlife health and trade. ",
      "Start": "12:15",
      "Type": [
        "Side event"
      ],
      "Start date - Panamanian date": "26/11/2025",
      "Start time - Panamanian Time": "12:15",
      "Last Modified": "2025-11-07T15:25:48.000Z"
    },
    {
      "id": "rec8EKG7gEaWGr4OH",
      "createdTime": "2025-11-14T17:11:14.000Z",
      "Title": "Bureau Meeting\n",
      "Organizer/Chair": "CoP20 Bureau",
      "Room ": "L. Orchid",
      "start date": "25/11/2025",
      "Start Time - sort": "2025-11-25T16:00:00.000Z",
      "End": "17:30",
      "Start": "17:00",
      "Type": [
        "Other"
      ],
      "Start date - Panamanian date": "25/11/2025",
      "Start time - Panamanian Time": "17:00",
      "Last Modified": "2025-11-14T17:11:25.000Z"
    },
    {
      "id": "rec8xMHvBWNXuHPd4",
      "createdTime": "2025-10-07T15:23:06.000Z",
      "Title": "CITES & Une Seule Santé (CITES & One Health)",
      "Organizer/Chair": "Sénégal",
      "Room ": "S.Falcon (70)",
      "start date": "24/11/2025",
      "Start Time - sort": "2025-11-24T12:00:00.000Z",
      "End": "14:30",
      "Description of the side event": "Le commerce international d'espèces sauvages, en particulier d'animaux vivants, est reconnu comme un facteur important contribuant au risque d'émergence, de propagation et de transmission de pathogènes zoonotiques. La mise en œuvre de réglementations internationales sur le commerce des espèces sauvages a un rôle important à jouer dans la prévention, la préparation et la réponse aux futures épidémies et pandémies d'origine zoonotique, à court et à long terme. Cet événement réunira des experts dans les domaines du commerce international des espèces sauvages, de la santé animale et des politiques associées, qui : identifieront les risques de propagation zoonotique associés au commerce international des espèces inscrites à la CITES ; examiner le rôle que les autorités CITES peuvent jouer dans l'atténuation de ces risques grâce à l'adoption et à la mise en œuvre d'une approche « One Health » ; et discuter des mécanismes qui peuvent être adoptés par la Convention pour faciliter ce rôle ; et réfléchir à la manière dont les autorités CITES peuvent contribuer à la mise en œuvre effective de l'accord sur les pandémies adopté par l'Assemblée mondiale de la santé en mai 2025. ",
      "Start": "13:00",
      "Type": [
        "Side event"
      ],
      "Start date - Panamanian date": "24/11/2025",
      "Start time - Panamanian Time": "13:00",
      "Last Modified": "2025-11-19T09:10:23.000Z"
    },
    {
      "id": "rec9WR39W29qS7d4h",
      "createdTime": "2025-10-07T15:23:06.000Z",
      "Title": "Scales of Success",
      "Organizer/Chair": "Louisiana Alligator Advisory Council ",
      "Room ": "Markhor S. (70)",
      "start date": "2/12/2025",
      "Start Time - sort": "2025-12-02T16:15:00.000Z",
      "End": "18:45",
      "Description of the side event": "Celebratory side event highlighting one of CITES’ greatest conservation triumphs—the recovery of the American alligator.  ",
      "Start": "17:15",
      "Type": [
        "Side event"
      ],
      "Start date - Panamanian date": "2/12/2025",
      "Start time - Panamanian Time": "17:15",
      "Last Modified": "2025-11-07T15:25:48.000Z"
    },
    {
      "id": "rec9bf4NTpjeEw89b",
      "createdTime": "2025-10-07T15:23:06.000Z",
      "Title": "Evidence gaps in wildlife supply chains: a case study of the saiga antelope",
      "Organizer/Chair": "Saiga Conservation Alliance",
      "Room ": "Saiga A. (120)",
      "start date": "3/12/2025",
      "Start Time - sort": "2025-12-03T11:15:00.000Z",
      "End": "13:45",
      "Description of the side event": "aspects of conservation initiatives  ",
      "Start": "12:15",
      "Type": [
        "Side event"
      ],
      "Start date - Panamanian date": "3/12/2025",
      "Start time - Panamanian Time": "12:15",
      "Last Modified": "2025-11-07T15:25:48.000Z"
    },
    {
      "id": "recBAbhhk4cucaS4D",
      "createdTime": "2025-10-29T14:20:41.000Z",
      "Title": "Nigeria’s New Wildlife Law",
      "Organizer/Chair": "Co-hosted: Government of Nigeria and Environmental Investigation Agency UK",
      "Room ": "B.Stork (70)",
      "start date": "24/11/2025",
      "Start Time - sort": "2025-11-24T12:00:00.000Z",
      "End": "14:30",
      "Description of the side event": "The event will explore both the content of the Bill and lessons from its develoent, offering insights for other nations seeking to build effective wildlife laws. It will also consider opportunities for collaboration and the challenges ahead in putting the Bill into practice. ",
      "Start": "13:00",
      "Type": [
        "Side event"
      ],
      "Start date - Panamanian date": "24/11/2025",
      "Start time - Panamanian Time": "13:00",
      "Last Modified": "2025-11-12T11:50:14.000Z"
    },
    {
      "id": "recBIn2RhKsVLwWbA",
      "createdTime": "2025-10-07T15:23:06.000Z",
      "Title": "Trade, African Vultures",
      "Organizer/Chair": "Niger, co-sponsored by the Convention on Migratory Species (via the Raptors MoU), BirdLife International, the IUCN SSC Vulture Specialist Group (VSG), and the Species Survival Network (SSN).",
      "Room ": "Bukahra D. (120)",
      "start date": "2/12/2025",
      "Start Time - sort": "2025-12-02T18:00:00.000Z",
      "End": "20:30",
      "Description of the side event": "A group of 13 West and Central African countries has jointly submitted a proposal to transfer the White-backed Vulture (Gyps africanus) and the Rüppell’s Vulture (Gyps rueppelli) from CITES Appendix II to Appendix I, with the aim of strengthening their international protection and more effectively addressing illegal trade. Support informed decision-making regarding the uplisting proposal. ",
      "Start": "19:00",
      "Type": [
        "Side event"
      ],
      "Start date - Panamanian date": "2/12/2025",
      "Start time - Panamanian Time": "19:00",
      "Last Modified": "2025-11-07T15:25:48.000Z"
    },
    {
      "id": "recBPa0NcK0f3lvgY",
      "createdTime": "2025-10-07T15:23:06.000Z",
      "Title": "Building Innovative responses to wildlife cybercrime",
      "Organizer/Chair": "IFAW, co-hosted by GITOC, EU",
      "Room ": "Markhor S. (70)",
      "start date": "27/11/2025",
      "Start Time - sort": "2025-11-27T18:00:00.000Z",
      "End": "20:30",
      "Description of the side event": "Will examine best-practice by Parties to modernise and adapt legislation and policy frameworks to address the dynamic nature of online markets. This includes updating national laws to explicitly criminalise digital illicit wildlife trade and wildlife trafficking and defining the responsibilities of online platforms. ",
      "Start": "19:00",
      "Type": [
        "Side event"
      ],
      "Start date - Panamanian date": "27/11/2025",
      "Start time - Panamanian Time": "19:00",
      "Last Modified": "2025-11-07T15:23:02.000Z"
    },
    {
      "id": "recBsUsModmnv6zdw",
      "createdTime": "2025-10-31T16:10:17.000Z",
      "Title": "Committee II",
      "Room ": "Rhodiola S. (Com II)",
      "start date": "3/12/2025",
      "Start Time - sort": "2025-12-03T08:00:00.000Z",
      "End": "12:00",
      "Start": "09:00",
      "Type": [
        "Main mtg"
      ],
      "Start date - Panamanian date": "3/12/2025",
      "Start time - Panamanian Time": "09:00",
      "Last Modified": "2025-10-31T16:22:03.000Z"
    },
    {
      "id": "recEC1IgyBr5Wdmjs",
      "createdTime": "2025-10-07T15:23:06.000Z",
      "Title": "Cheetah's in India",
      "Organizer/Chair": "India",
      "Room ": "Bukahra D. (120)",
      "start date": "3/12/2025",
      "Start Time - sort": "2025-12-03T11:15:00.000Z",
      "End": "13:45",
      "Description of the side event": "The Side event will have Cheetah expert, Government officials, etc, presenting on the different aspects of conservation initiatives ",
      "Start": "12:15",
      "Type": [
        "Side event"
      ],
      "Start date - Panamanian date": "3/12/2025",
      "Start time - Panamanian Time": "12:15",
      "Last Modified": "2025-11-07T15:25:48.000Z"
    },
    {
      "id": "recEFYVkru6TJJ62h",
      "createdTime": "2025-10-07T15:23:06.000Z",
      "Title": "Commiphora wightii",
      "Organizer/Chair": "Germany ",
      "Room ": "B.Stork (70)",
      "start date": "25/11/2025",
      "Start Time - sort": "2025-11-25T11:15:00.000Z",
      "End": "13:45",
      "Description of the side event": "Provides a summary of the key findings of the research and consultations that resulted in the amendment proposal for Commiphora wightii for CITES App. II. Compliance with the listing criteria for CITES Art. II and Resolution Conf. 9.24 (Rev. CoP17) will be demonstrated and possible implications of a listing in App. II presented. ",
      "Start": "12:15",
      "Type": [
        "Side event"
      ],
      "Start date - Panamanian date": "25/11/2025",
      "Start time - Panamanian Time": "12:15",
      "Last Modified": "2025-11-07T15:25:48.000Z"
    },
    {
      "id": "recEtNjDsRSFaWgAp",
      "createdTime": "2025-10-31T16:07:46.000Z",
      "Title": "Committee II",
      "Room ": "Rhodiola S. (Com II)",
      "start date": "27/11/2025",
      "Start Time - sort": "2025-11-27T13:00:00.000Z",
      "End": "17:00",
      "Start": "14:00",
      "Type": [
        "Main mtg"
      ],
      "Start date - Panamanian date": "27/11/2025",
      "Start time - Panamanian Time": "14:00",
      "Last Modified": "2025-10-31T16:21:56.000Z"
    },
    {
      "id": "recFPMznRa22T12nL",
      "createdTime": "2025-10-07T15:23:06.000Z",
      "Title": "Asian big cats & CITES",
      "Organizer/Chair": "Born Free Foundation, co-hosted with Go Insight, WWF, TRAFFIC, EIA, Panthera, WCS and possibly others",
      "Room ": "C.A.Tortoise (40)",
      "start date": "26/11/2025",
      "Start Time - sort": "2025-11-26T18:00:00.000Z",
      "End": "20:30",
      "Description of the side event": "This side event will present key findings and recommendations from a new report examining trends in ABC legal and illegal trade and their population status. It will also assess the implementation of existing CITES measures, highlighting gaps and opportunities for strengthened action. ",
      "Start": "19:00",
      "Type": [
        "Side event"
      ],
      "Start date - Panamanian date": "26/11/2025",
      "Start time - Panamanian Time": "19:00",
      "Last Modified": "2025-11-07T15:25:48.000Z"
    },
    {
      "id": "recFjptpLf46Udcl5",
      "createdTime": "2025-10-07T15:23:06.000Z",
      "Title": "Returning Big Cats to Central Asia",
      "Organizer/Chair": "WWF Central Asia",
      "Room ": "C.A.Tortoise (40)",
      "start date": "2/12/2025",
      "Start Time - sort": "2025-12-02T18:00:00.000Z",
      "End": "20:30",
      "Description of the side event": "Tigers, cheetah and snow leopards in Central Asia - reintroduction and conservation projects.  ",
      "Start": "19:00",
      "Type": [
        "Side event"
      ],
      "Start date - Panamanian date": "2/12/2025",
      "Start time - Panamanian Time": "19:00",
      "Last Modified": "2025-11-11T10:39:54.000Z"
    },
    {
      "id": "recHLc71FcJ9E4Rbm",
      "createdTime": "2025-10-07T15:23:06.000Z",
      "Title": "Shaping CITES’ Future",
      "Organizer/Chair": "Born Free Foundation",
      "Room ": "B.Stork (70)",
      "start date": "3/12/2025",
      "Start Time - sort": "2025-12-03T11:15:00.000Z",
      "End": "13:45",
      "Description of the side event": "Explore how CITES can proactively address challenges and opportunities in this ‘brave new world’. ",
      "Start": "12:15",
      "Type": [
        "Side event"
      ],
      "Start date - Panamanian date": "3/12/2025",
      "Start time - Panamanian Time": "12:15",
      "Last Modified": "2025-11-07T15:25:48.000Z"
    },
    {
      "id": "recHgG9ewzODgbaFW",
      "createdTime": "2025-10-31T16:09:15.000Z",
      "Title": "Committee II",
      "Room ": "Rhodiola S. (Com II)",
      "start date": "29/11/2025",
      "Start Time - sort": "2025-11-29T13:00:00.000Z",
      "End": "17:00",
      "Start": "14:00",
      "Type": [
        "Main mtg"
      ],
      "Start date - Panamanian date": "29/11/2025",
      "Start time - Panamanian Time": "14:00",
      "Last Modified": "2025-10-31T16:22:00.000Z"
    },
    {
      "id": "recHhsaMiMmpbVQ63",
      "createdTime": "2025-10-07T15:23:06.000Z",
      "Title": "Stockpile & HEC tools",
      "Organizer/Chair": "Co-hosted by the Governments of Angola, Ethiopia, Malawi and Nigeria with the EPI Foundation",
      "Room ": "Markhor S. (70)",
      "start date": "27/11/2025",
      "Start Time - sort": "2025-11-27T16:15:00.000Z",
      "End": "18:45",
      "Description of the side event": "A demonstration of EPI tools to strengthen stockpile management and thereby assist Parties to meet their CITES commitments under resolutions 10:10 and 17:10, with practical examples from EPI member countries; and tools deployed by EPI Foundation to tackle human-elephant conflict.",
      "Start": "17:15",
      "Type": [
        "Side event"
      ],
      "Start date - Panamanian date": "27/11/2025",
      "Start time - Panamanian Time": "17:15",
      "Last Modified": "2025-11-07T15:23:02.000Z"
    },
    {
      "id": "recHk8C5Znc3mPWEm",
      "createdTime": "2025-11-18T15:17:43.000Z",
      "Title": "CITES Secretariat - Closed meeting",
      "Organizer/Chair": "CITES Secretariat - Closed meeting",
      "Room ": "D. Monitor (32)",
      "start date": "26/11/2025",
      "Start Time - sort": "2025-11-26T11:30:00.000Z",
      "End": "14:00",
      "Description of the side event": "CITES Secretariat - Closed meeting",
      "Start": "12:30",
      "Type": [
        "Other"
      ],
      "Start date - Panamanian date": "26/11/2025",
      "Start time - Panamanian Time": "12:30",
      "Last Modified": "2025-11-18T15:18:09.000Z"
    },
    {
      "id": "recI3Nyf9ZEgZm13p",
      "createdTime": "2025-10-29T14:20:41.000Z",
      "Title": "HEC Toolbox Exhibition",
      "Organizer/Chair": "Save the Elephants",
      "Room ": "Markhor S. (70)",
      "start date": "3/12/2025",
      "Start Time - sort": "2025-12-03T18:00:00.000Z",
      "End": "20:30",
      "Description of the side event": "This exhibition booth showcases Save the Elephants' Human-Elephant Coexistence Toolbox, a comprehensive manual presenting over 80 scientifically-tested methods for communities to live safely and sustainably alongside elephants. ",
      "Start": "19:00",
      "Type": [
        "Side event"
      ],
      "Start date - Panamanian date": "3/12/2025",
      "Start time - Panamanian Time": "19:00",
      "Last Modified": "2025-11-07T15:25:48.000Z"
    },
    {
      "id": "recIBmHOsPks2mqoo",
      "createdTime": "2025-10-07T15:22:45.000Z",
      "Title": "Deepwater Sharks, Rays and Chimaeras: the need for Trade, Conservation and Management Attention",
      "Organizer/Chair": "TRAFFIC with co-hosts",
      "Room ": "Markhor S. (70)",
      "start date": "4/12/2025",
      "Start Time - sort": "2025-12-04T18:00:00.000Z",
      "End": "20:30",
      "Description of the side event": "This side event will present information on the planned actions and work plan of the Coalition, noting its relevance to CITES and its Parties and Intergovernmental and non-government organisations. ",
      "Start": "19:00",
      "Type": [
        "Side event"
      ],
      "Start date - Panamanian date": "4/12/2025",
      "Start time - Panamanian Time": "19:00",
      "Last Modified": "2025-11-07T15:25:48.000Z"
    },
    {
      "id": "recImr5DPZzFNHceZ",
      "createdTime": "2025-10-07T15:23:06.000Z",
      "Title": "Nature's Project: Forest Eco-classification for Biodiversity",
      "Organizer/Chair": "Ministry of Ecology, Environmental Protection and Climate Change “Green Engineering” Design Institute under",
      "Room ": "G.Bustard (40)",
      "start date": "27/11/2025",
      "Start Time - sort": "2025-11-27T16:00:00.000Z",
      "End": "18:30",
      "Description of the side event": "Nature's Project: Forest Eco-classification for Biodiversity",
      "Start": "17:00",
      "Type": [
        "Side event"
      ],
      "Start date - Panamanian date": "27/11/2025",
      "Start time - Panamanian Time": "17:00",
      "Last Modified": "2025-11-12T08:41:56.000Z"
    },
    {
      "id": "recJQXlxyU8q1I7FE",
      "createdTime": "2025-10-07T15:23:06.000Z",
      "Title": "Confiscation Networks",
      "Organizer/Chair": "Association of Zoos and Aquariums",
      "Room ": "S.Falcon (70)",
      "start date": "26/11/2025",
      "Start Time - sort": "2025-11-26T18:00:00.000Z",
      "End": "20:30",
      "Description of the side event": "Will explore policy frameworks and practical mechanisms for creating and strengthening networks that connect wildlife enforcement with qualified animal care facilities, rehabilitation programs, and conservation initiatives.  ",
      "Start": "19:00",
      "Type": [
        "Side event"
      ],
      "Start date - Panamanian date": "26/11/2025",
      "Start time - Panamanian Time": "19:00",
      "Last Modified": "2025-11-07T15:25:48.000Z"
    },
    {
      "id": "recJkObUxNA1nJJjM",
      "createdTime": "2025-10-07T15:23:06.000Z",
      "Title": "Official Signing ceremony of “Integrated Natural Resources Management for Improved Ecosystem Conservation and Biodiversity Preservation” project",
      "Organizer/Chair": "Ministry of Ecology, Environmental Protection and Climate Change FAO-Uzbekistan",
      "Room ": "Caracal (Press)",
      "start date": "25/11/2025",
      "Start Time - sort": "2025-11-25T16:00:00.000Z",
      "End": "18:00",
      "Description of the side event": "Official Signing ceremony of “Integrated Natural Resources Management for Improved Ecosystem Conservation and Biodiversity Preservation” project ",
      "Start": "17:00",
      "Type": [
        "Side event"
      ],
      "Start date - Panamanian date": "25/11/2025",
      "Start time - Panamanian Time": "17:00",
      "Last Modified": "2025-11-14T09:22:17.000Z"
    },
    {
      "id": "recJzGxpPAYBSftef",
      "createdTime": "2025-10-07T15:23:06.000Z",
      "Title": "Is ‘Ranching’ relevant to aquatic species? Case studies, implications and challenges",
      "Organizer/Chair": "ADM Capital Foundation (co-hosted with WWF, TRAFFIC,  International Council of Environmental Law, IUCN SSC Groupers and Wrasses Specialist Group, U.S. Fish and Wildlife Service)",
      "Room ": "Saiga A. (120)",
      "start date": "28/11/2025",
      "Start Time - sort": "2025-11-28T16:15:00.000Z",
      "End": "18:45",
      "Description of the side event": "Examines ranching’s evolution, its relevance for aquatic species, and associated sustainability, legal, and enforcement challenges for CITES-listed taxa like Anguilla spp. and Cheilinus undulatus. ",
      "Start": "17:15",
      "Type": [
        "Side event"
      ],
      "Start date - Panamanian date": "28/11/2025",
      "Start time - Panamanian Time": "17:15",
      "Last Modified": "2025-11-18T12:41:35.000Z"
    },
    {
      "id": "recKbF485FQnwvboN",
      "createdTime": "2025-10-31T16:07:46.000Z",
      "Title": "Committee I",
      "Room ": "Argali (Com I)",
      "start date": "27/11/2025",
      "Start Time - sort": "2025-11-27T13:00:00.000Z",
      "End": "17:00",
      "Start": "14:00",
      "Type": [
        "Main mtg"
      ],
      "Start date - Panamanian date": "27/11/2025",
      "Start time - Panamanian Time": "14:00",
      "Last Modified": "2025-10-31T16:21:20.000Z"
    },
    {
      "id": "recKvMmu5pCJNnnWT",
      "createdTime": "2025-10-07T15:23:06.000Z",
      "Title": "Science, cooperation and community: the path of hope for the vaquita marina",
      "Organizer/Chair": "Mexico",
      "Room ": "Caracal (Press)",
      "start date": "27/11/2025",
      "Start Time - sort": "2025-11-27T11:15:00.000Z",
      "End": "13:45",
      "Description of the side event": "Science, cooperation and community: the path of hope for the vaquita marina",
      "Start": "12:15",
      "Type": [
        "Side event"
      ],
      "Start date - Panamanian date": "27/11/2025",
      "Start time - Panamanian Time": "12:15",
      "Last Modified": "2025-11-07T15:25:48.000Z"
    },
    {
      "id": "recLmHlBtknzsXywm",
      "createdTime": "2025-11-14T12:47:03.000Z",
      "Title": "Closing Press Conference\n",
      "Organizer/Chair": "CITES Secretariat and Uzbekistan",
      "Room ": "Caracal (Press)",
      "start date": "5/12/2025",
      "Start Time - sort": "2025-12-05T12:00:00.000Z",
      "End": "14:00",
      "Start": "13:00",
      "Type": [
        "Other"
      ],
      "Start date - Panamanian date": "5/12/2025",
      "Start time - Panamanian Time": "13:00",
      "Last Modified": "2025-11-14T13:42:59.000Z"
    },
    {
      "id": "recLvrOJGPAet7dNm",
      "createdTime": "2025-10-31T16:07:17.000Z",
      "Title": "Committee II",
      "Room ": "Rhodiola S. (Com II)",
      "start date": "26/11/2025",
      "Start Time - sort": "2025-11-26T13:00:00.000Z",
      "End": "17:00",
      "Start": "14:00",
      "Type": [
        "Main mtg"
      ],
      "Start date - Panamanian date": "26/11/2025",
      "Start time - Panamanian Time": "14:00",
      "Last Modified": "2025-10-31T16:21:54.000Z"
    },
    {
      "id": "recLz0oxiNtCYgwmU",
      "createdTime": "2025-10-07T15:23:06.000Z",
      "Title": "Data for Enforcement",
      "Organizer/Chair": "CITES Secretariat - ICCWC",
      "Room ": "Bukahra D. (120)",
      "start date": "27/11/2025",
      "Start Time - sort": "2025-11-27T11:15:00.000Z",
      "End": "13:45",
      "Description of the side event": "Why is data so important for combating wildlife crime? This event will address this critical question, offering insights into the data available to Parties, preliminary research findings on wildlife crime linked to the Internet, and data-relevant tools available through ICCWC",
      "Start": "12:15",
      "Type": [
        "Side event"
      ],
      "Start date - Panamanian date": "27/11/2025",
      "Start time - Panamanian Time": "12:15",
      "Last Modified": "2025-11-17T12:23:51.000Z"
    },
    {
      "id": "recMHqVtSk9oeSW2N",
      "createdTime": "2025-10-07T15:23:06.000Z",
      "Title": "CITES and Forests",
      "Organizer/Chair": "CITES Secretariat ",
      "Room ": "Markhor S. (70)",
      "start date": "25/11/2025",
      "Start Time - sort": "2025-11-25T11:15:00.000Z",
      "End": "13:45",
      "Description of the side event": "Presentation of the matrices that informed the outcomes, the potential scope of an initiative on CITES and forests that will enhance the implementation of the Convention as it relates to forests (with a focus on tree species), and recommendations to enhance the effective implementation of the Convention with respects to CITES-listed forest species. ",
      "Start": "12:15",
      "Type": [
        "Side event"
      ],
      "Start date - Panamanian date": "25/11/2025",
      "Start time - Panamanian Time": "12:15",
      "Last Modified": "2025-11-11T09:52:20.000Z"
    },
    {
      "id": "recMQeMthHOZA1Tzc",
      "createdTime": "2025-10-07T15:23:06.000Z",
      "Title": "ETIS 2.0 - What's new?",
      "Organizer/Chair": "TRAFFIC",
      "Room ": "S.Falcon (70)",
      "start date": "28/11/2025",
      "Start Time - sort": "2025-11-28T18:00:00.000Z",
      "End": "20:30",
      "Description of the side event": "Outline key functionalities and processes now available to Parties through ETIS Online ",
      "Start": "19:00",
      "Type": [
        "Side event"
      ],
      "Start date - Panamanian date": "28/11/2025",
      "Start time - Panamanian Time": "19:00",
      "Last Modified": "2025-11-07T15:25:48.000Z"
    },
    {
      "id": "recN3zfilyL2PuBtw",
      "createdTime": "2025-10-07T15:23:06.000Z",
      "Title": "A Life Among Elephants",
      "Organizer/Chair": "Save the Elephants",
      "Room ": "Saiga A. (120)",
      "start date": "4/12/2025",
      "Start Time - sort": "2025-12-04T18:00:00.000Z",
      "End": "20:30",
      "Description of the side event": "This event demonstrates the critical role of long-term scientific research in developing effective, sustainable solutions for human-wildlife conflict. ",
      "Start": "19:00",
      "Type": [
        "Side event"
      ],
      "Start date - Panamanian date": "4/12/2025",
      "Start time - Panamanian Time": "19:00",
      "Last Modified": "2025-11-07T15:25:48.000Z"
    },
    {
      "id": "recNGoqLpFaglXnd0",
      "createdTime": "2025-10-07T15:23:06.000Z",
      "Title": "How to Conserve Rhinos",
      "Organizer/Chair": "International Rhino Foundation. Save the Rhino \nInternational (co-host)",
      "Room ": "Markhor S. (70)",
      "start date": "5/12/2025",
      "Start Time - sort": "2025-12-05T11:15:00.000Z",
      "End": "13:45",
      "Description of the side event": "At this event, International Rhino Foundation and Save the Rhino International will facilitate a panel discussion with rhino conservation, wildlife trade and law enforcement experts, and representatives from rhino range States and CITES Parties affected by the illegal trade in rhino horn specimens. The session will assess what is working, what lessons have been learned and where change is required in order to achieve transformational progress in global rhino conservation efforts. Active engagement with the expert panelists, as well as audience participation, will identify specific recommendations for law enforcement officials and the global conservation community on how to best advance conservation efforts for both African and Asian rhino species. ",
      "Start": "12:15",
      "Type": [
        "Side event"
      ],
      "Start date - Panamanian date": "5/12/2025",
      "Start time - Panamanian Time": "12:15",
      "Last Modified": "2025-11-07T15:24:04.000Z"
    },
    {
      "id": "recNzF75twYXkYy8o",
      "createdTime": "2025-10-07T15:23:06.000Z",
      "Title": "CAR-WEN Initiative",
      "Organizer/Chair": "Sustainable Innovation Initiatives (SII), co-hosted with the Caribbean Wildlife Enforcement Network (CAR-WEN) Working Group with 20+ participating Caribbean governments",
      "Room ": "S.Falcon (70)",
      "start date": "5/12/2025",
      "Start Time - sort": "2025-12-05T11:15:00.000Z",
      "End": "13:45",
      "Description of the side event": "The Caribbean Wildlife Enforcement Network (CAR-WEN) initiative addresses the escalating wildlife crime crisis across the wider Caribbean Region, including illegal trade in parrots, reptiles, marine organisms, and wildlife-derived products. Wildlife crime severely threatens biodiversity conservation, public health, human well-being, animal welfare, and the rule of law. Led by a Working Group of more than 20 Caribbean governments, CAR-WEN’s mission is to formally establish a fully integrated regional wildlife enforcement network aligned with CITES enforcement commitments. This CITES CoP20 side event introduces the CAR-WEN’s vision, strategic priorities, and immediate opportunities for regional and global collaboration.",
      "Start": "12:15",
      "Type": [
        "Side event"
      ],
      "Start date - Panamanian date": "5/12/2025",
      "Start time - Panamanian Time": "12:15",
      "Last Modified": "2025-11-07T15:24:04.000Z"
    },
    {
      "id": "recO2i5gerhgZXAdP",
      "createdTime": "2025-10-07T15:23:06.000Z",
      "Title": "CITES Enforcement",
      "Organizer/Chair": "European Union and China",
      "Room ": "Bukahra D. (120)",
      "start date": "24/11/2025",
      "Start Time - sort": "2025-11-24T12:00:00.000Z",
      "End": "14:30",
      "Description of the side event": "\"Countering the international illegal trade in endangered species requires a multifaceted approach and effective cooperation between countries. China and the European Union (EU) are among the key trading partners, as well as origin and destination for many CITES-listed species. \nThe side-event will update participants on efforts in the EU and China, highlighting challenges and opportunities towards combatting wildlife crime, including through cooperation, exchange and joint actions. Effective interventions to address illegal and unsustainable wildlife trade include enabling strong policy frameworks, law enforcement, capacity-building and technical assistance along the trade chains, through to consumer demand change.",
      "Start": "13:00",
      "Type": [
        "Side event"
      ],
      "Start date - Panamanian date": "24/11/2025",
      "Start time - Panamanian Time": "13:00",
      "Last Modified": "2025-11-12T11:24:22.000Z"
    },
    {
      "id": "recObqdsshuwdOXjv",
      "createdTime": "2025-10-07T15:23:06.000Z",
      "Title": "United for Hammerheads!",
      "Organizer/Chair": "SHARKPROJECT International. Cohosted with Marine Watch International.",
      "Room ": "Bukahra D. (120)",
      "start date": "2/12/2025",
      "Start Time - sort": "2025-12-02T16:15:00.000Z",
      "End": "18:45",
      "Description of the side event": "Emphasizes collaboration across producer, transit, and consumer states: aligning science, closing loopholes, and strengthening shared knowledge. ",
      "Start": "17:15",
      "Type": [
        "Side event"
      ],
      "Start date - Panamanian date": "2/12/2025",
      "Start time - Panamanian Time": "17:15",
      "Last Modified": "2025-11-07T15:25:48.000Z"
    },
    {
      "id": "recOfE0sWPW7eZbow",
      "createdTime": "2025-10-31T16:04:52.000Z",
      "Title": "Committee I",
      "Room ": "Argali (Com I)",
      "start date": "25/11/2025",
      "Start Time - sort": "2025-11-25T13:00:00.000Z",
      "End": "17:00",
      "Start": "14:00",
      "Type": [
        "Main mtg"
      ],
      "Start date - Panamanian date": "25/11/2025",
      "Start time - Panamanian Time": "14:00",
      "Last Modified": "2025-10-31T16:21:12.000Z"
    },
    {
      "id": "recOmPSQ8HzRoxM19",
      "createdTime": "2025-11-14T17:11:54.000Z",
      "Title": "Bureau Meeting\n",
      "Organizer/Chair": "CoP20 Bureau",
      "Room ": "L. Orchid",
      "start date": "27/11/2025",
      "Start Time - sort": "2025-11-27T16:00:00.000Z",
      "End": "17:30",
      "Start": "17:00",
      "Type": [
        "Other"
      ],
      "Start date - Panamanian date": "27/11/2025",
      "Start time - Panamanian Time": "17:00",
      "Last Modified": "2025-11-14T17:12:07.000Z"
    },
    {
      "id": "recP4YgHTGiQHRZTF",
      "createdTime": "2025-10-31T16:07:17.000Z",
      "Title": "Committee II",
      "Room ": "Rhodiola S. (Com II)",
      "start date": "26/11/2025",
      "Start Time - sort": "2025-11-26T08:00:00.000Z",
      "End": "12:00",
      "Start": "09:00",
      "Type": [
        "Main mtg"
      ],
      "Start date - Panamanian date": "26/11/2025",
      "Start time - Panamanian Time": "09:00",
      "Last Modified": "2025-10-31T16:21:53.000Z"
    },
    {
      "id": "recPDohyyoTyrcT3G",
      "createdTime": "2025-10-07T15:23:06.000Z",
      "Title": "CPW in Action & Beyond",
      "Organizer/Chair": "Collaborative Partnership on Sustainable Wildlife Management (CPW) - Co-hosted by CPW Partner Organizations including FAO, CBD, CIFOR, CITES, CMS, CIC, IIED, IIFB, IUCN, IUFRO, TRAFFIC, UNEP, WOAH",
      "Room ": "Saiga A. (120)",
      "start date": "28/11/2025",
      "Start Time - sort": "2025-11-28T11:15:00.000Z",
      "End": "13:45",
      "Description of the side event": "Showcase highlights from the CPW Work Plan 2023–2025, featuring collaborative efforts in areas such as legal coherence, human-wildlife conflict, One Health, and wildlife-based economies. It will also mark the official launch of the CPW Work Plan 2026–2028, a renewed framework designed to align with global biodiversity and develoent priorities while advancing practical, joint action across sectors. ",
      "Start": "12:15",
      "Type": [
        "Side event"
      ],
      "Start date - Panamanian date": "28/11/2025",
      "Start time - Panamanian Time": "12:15",
      "Last Modified": "2025-11-07T15:25:48.000Z"
    },
    {
      "id": "recPIp7jQgDhA8pDj",
      "createdTime": "2025-10-07T15:23:06.000Z",
      "Title": "An Illusion of Legality: Wildlife Laundering in International Trade",
      "Organizer/Chair": "Royal United Services Institute, co-hosted with TRAFFIC",
      "Room ": "S.Falcon (70)",
      "start date": "28/11/2025",
      "Start Time - sort": "2025-11-28T11:15:00.000Z",
      "End": "13:45",
      "Description of the side event": "Share key findings and discuss their implications with the CITES community, with particular relevance to proposals being considered at CoP20. It will also offer insights into how international and domestic regulatory systems can better close gaps that currently enable laundering under the cover of legality. ",
      "Start": "12:15",
      "Type": [
        "Side event"
      ],
      "Start date - Panamanian date": "28/11/2025",
      "Start time - Panamanian Time": "12:15",
      "Last Modified": "2025-11-07T15:25:48.000Z"
    },
    {
      "id": "recPdO62akXjLptVR",
      "createdTime": "2025-10-31T16:09:36.000Z",
      "Title": "Committee II",
      "Room ": "Rhodiola S. (Com II)",
      "start date": "2/12/2025",
      "Start Time - sort": "2025-12-02T13:00:00.000Z",
      "End": "17:00",
      "Start": "14:00",
      "Type": [
        "Main mtg"
      ],
      "Start date - Panamanian date": "2/12/2025",
      "Start time - Panamanian Time": "14:00",
      "Last Modified": "2025-10-31T16:22:02.000Z"
    },
    {
      "id": "recPvzHUZOPzEZ4rC",
      "createdTime": "2025-11-14T17:12:11.000Z",
      "Title": "Bureau Meeting\n",
      "Organizer/Chair": "CoP20 Bureau",
      "Room ": "L. Orchid",
      "start date": "28/11/2025",
      "Start Time - sort": "2025-11-28T16:00:00.000Z",
      "End": "17:30",
      "Start": "17:00",
      "Type": [
        "Other"
      ],
      "Start date - Panamanian date": "28/11/2025",
      "Start time - Panamanian Time": "17:00",
      "Last Modified": "2025-11-14T17:12:19.000Z"
    },
    {
      "id": "recQK3iGxRtYaLxke",
      "createdTime": "2025-10-31T16:09:36.000Z",
      "Title": "Committee II",
      "Room ": "Rhodiola S. (Com II)",
      "start date": "2/12/2025",
      "Start Time - sort": "2025-12-02T08:00:00.000Z",
      "End": "12:00",
      "Start": "09:00",
      "Type": [
        "Main mtg"
      ],
      "Start date - Panamanian date": "2/12/2025",
      "Start time - Panamanian Time": "09:00",
      "Last Modified": "2025-10-31T16:22:01.000Z"
    },
    {
      "id": "recQWpUA6Ol0Q9rj9",
      "createdTime": "2025-10-07T15:23:06.000Z",
      "Title": "Illicit Yet Legal Trade",
      "Organizer/Chair": "Pro Wildlife (co-hosted by IFAW, WCS, Four Paws & Humane World for Animals)",
      "Room ": "Saiga A. (120)",
      "start date": "26/11/2025",
      "Start Time - sort": "2025-11-26T18:00:00.000Z",
      "End": "20:30",
      "Description of the side event": "The side event will focus on international trade in species that have been illegally collected in their country of origin but legally traded internationally. ",
      "Start": "19:00",
      "Type": [
        "Side event"
      ],
      "Start date - Panamanian date": "26/11/2025",
      "Start time - Panamanian Time": "19:00",
      "Last Modified": "2025-11-07T15:25:48.000Z"
    },
    {
      "id": "recQiL809zjsHz0Lt",
      "createdTime": "2025-10-31T16:06:15.000Z",
      "Title": "Committee II",
      "Room ": "Rhodiola S. (Com II)",
      "start date": "25/11/2025",
      "Start Time - sort": "2025-11-25T08:00:00.000Z",
      "End": "12:00",
      "Start": "09:00",
      "Type": [
        "Main mtg"
      ],
      "Start date - Panamanian date": "25/11/2025",
      "Start time - Panamanian Time": "09:00",
      "Last Modified": "2025-11-17T09:28:56.000Z"
    },
    {
      "id": "recRSw5aQNDNxsLSh",
      "createdTime": "2025-11-14T17:13:19.000Z",
      "Title": "Bureau Meeting",
      "Organizer/Chair": "CoP20 Bureau",
      "Room ": "L. Orchid",
      "start date": "5/12/2025",
      "Start Time - sort": "2025-12-05T16:00:00.000Z",
      "End": "17:30",
      "Start": "17:00",
      "Type": [
        "Other"
      ],
      "Start date - Panamanian date": "5/12/2025",
      "Start time - Panamanian Time": "17:00",
      "Last Modified": "2025-11-14T17:35:21.000Z"
    },
    {
      "id": "recRb2lduEYfFJITv",
      "createdTime": "2025-10-07T15:23:06.000Z",
      "Title": "Enforcement in action",
      "Organizer/Chair": "Wildlife Justice Commission. Event co-hosted by Nigeria.",
      "Room ": "Markhor S. (70)",
      "start date": "29/11/2025",
      "Start Time - sort": "2025-11-29T18:00:00.000Z",
      "End": "20:30",
      "Description of the side event": "Aimed at informing enforcement-focused discussions on transnational organized wildlife crime and supporting evidence-based policymaking by CITES Parties, the event will offer the latest data, trends, and actionable insights to ensure effective implementation of CITES provisions. ",
      "Start": "19:00",
      "Type": [
        "Side event"
      ],
      "Start date - Panamanian date": "29/11/2025",
      "Start time - Panamanian Time": "19:00",
      "Last Modified": "2025-11-07T15:25:48.000Z"
    },
    {
      "id": "recRl2CtZtc0z2Ydv",
      "createdTime": "2025-10-07T15:23:06.000Z",
      "Title": "AEAP Delivery: MIKE/AEF",
      "Organizer/Chair": "CITES Secretariat",
      "Room ": "S.Falcon (70)",
      "start date": "2/12/2025",
      "Start Time - sort": "2025-12-02T11:15:00.000Z",
      "End": "13:45",
      "Description of the side event": "Showcase the impact of the MIKE Programme and the African Elephant Fund through real-world experiences from the field. Panelists, including representatives from MIKE sites, elephant range States, donor institutions, and partner organizations, will share success stories and lessons learned. ",
      "Start": "12:15",
      "Type": [
        "Side event"
      ],
      "Start date - Panamanian date": "2/12/2025",
      "Start time - Panamanian Time": "12:15",
      "Last Modified": "2025-11-07T15:25:48.000Z"
    },
    {
      "id": "recSuknYhadmDsKlp",
      "createdTime": "2025-11-17T10:59:48.000Z",
      "Title": "Seventy-ninth meeting of the Standing Committee (SC79)",
      "Room ": "Argali (Com I)",
      "start date": "23/11/2025",
      "Start Time - sort": "2025-11-23T08:00:00.000Z",
      "End": "12:00",
      "Start": "09:00",
      "Type": [
        "Main mtg"
      ],
      "Start date - Panamanian date": "23/11/2025",
      "Start time - Panamanian Time": "09:00",
      "Last Modified": "2025-11-17T11:09:07.000Z"
    },
    {
      "id": "recT8aweKjk1BL1yO",
      "createdTime": "2025-11-17T11:15:23.000Z",
      "Title": "Plenary - ",
      "Room ": "Argali (Com I)",
      "start date": "5/12/2025",
      "Start Time - sort": "2025-12-05T08:00:00.000Z",
      "End": "12:00",
      "Start": "09:00",
      "Type": [
        "Main mtg"
      ],
      "Start date - Panamanian date": "5/12/2025",
      "Start time - Panamanian Time": "09:00",
      "Last Modified": "2025-11-17T11:18:23.000Z"
    },
    {
      "id": "recTGnqcOH2HsID3J",
      "createdTime": "2025-10-07T15:23:06.000Z",
      "Title": "Tech for Wildlife",
      "Organizer/Chair": "Conservation X Labs and Turkmenistan ",
      "Room ": "Markhor S. (70)",
      "start date": "24/11/2025",
      "Start Time - sort": "2025-11-24T12:00:00.000Z",
      "End": "14:30",
      "Description of the side event": "Guided by ICCWC’s Guidelines for Wildlife Enforcement Networks (2020) and successful regional enforcement initiatives like ASEAN-WEN and the Lusaka Agreement Task Force, the CAR-WEN Working Group has developed a range of materials and activities to establish a fully functioning wildlife enforcement network (WEN) in the Wider Caribbean. This includes development of a four-phase Strategic Plan, a draft Memorandum of Understanding (MOU), and pilot projects to build enforcement capacity, demonstrate immediate benefits, and foster regional commitment. With the MOU expected to open for signature by early next year, this event represents a timely opportunity for stakeholder input and engagement.",
      "Start": "13:00",
      "Type": [
        "Side event"
      ],
      "Start date - Panamanian date": "24/11/2025",
      "Start time - Panamanian Time": "13:00",
      "Last Modified": "2025-11-12T11:50:04.000Z"
    },
    {
      "id": "recTLqe9AaITlmleA",
      "createdTime": "2025-10-31T16:09:15.000Z",
      "Title": "Committee I",
      "Room ": "Argali (Com I)",
      "start date": "29/11/2025",
      "Start Time - sort": "2025-11-29T13:00:00.000Z",
      "End": "17:00",
      "Start": "14:00",
      "Type": [
        "Main mtg"
      ],
      "Start date - Panamanian date": "29/11/2025",
      "Start time - Panamanian Time": "14:00",
      "Last Modified": "2025-10-31T16:21:31.000Z"
    },
    {
      "id": "recTR1m5baJq4ckTD",
      "createdTime": "2025-10-07T15:23:06.000Z",
      "Title": "The Challenge of Defining \"Ruin\" versus \"Risk\" in Marine Species: Party proponents, FAO Expert Panel & Fishers talk to CoP20 Assessments on Shark, Eel, Sea Cucumbers & Shellfish",
      "Organizer/Chair": "UN FAO",
      "Room ": "Bukahra D. (120)",
      "start date": "26/11/2025",
      "Start Time - sort": "2025-11-26T16:15:00.000Z",
      "End": "18:45",
      "Description of the side event": "Description: Determining the balance between investments in fisheries management and biodiversity protection is in part shaped by consideration of CITES Resolution Conf. 9.24, and the ongoing debate between precautionary and evidence-based approaches.\nIn this Side Event discussion—drawing on inputs from Parties, the FAO Expert Panel convenor, proposal proponents, and fisheries organizations— we open the hood on approaches to assessing extinction risk for CoP20 Proposals 28–37 and 39.\nA central theme of this dialogue will be the characterization of ‘extinction risk’, with perspectives from fisheries, trade, and species conservation explored to highlight differing levels of risk tolerance and aversion.",
      "Start": "17:15",
      "Type": [
        "Side event"
      ],
      "Start date - Panamanian date": "26/11/2025",
      "Start time - Panamanian Time": "17:15",
      "Last Modified": "2025-11-07T15:25:48.000Z"
    },
    {
      "id": "recTSihoelQvp45K4",
      "createdTime": "2025-10-07T15:23:06.000Z",
      "Title": "Uplisting to release - CITES and National Action Driving Success for the Barbary Macaque",
      "Organizer/Chair": "Animal Advocacy and Protection (AAP); co-hosts: Morocco; Utrecht University",
      "Room ": "G.Bustard (40)",
      "start date": "25/11/2025",
      "Start Time - sort": "2025-11-25T11:15:00.000Z",
      "End": "13:45",
      "Description of the side event": "Explore the impact of the macaque’s uplisting to CITES Appendix I and how it sparked a systemic national response in Morocco. Since 2017, stronger enforcement, public awareness campaigns, and government-led protection of wild populations have helped reduce illegal trade.  ",
      "Start": "12:15",
      "Type": [
        "Side event"
      ],
      "Start date - Panamanian date": "25/11/2025",
      "Start time - Panamanian Time": "12:15",
      "Last Modified": "2025-11-07T15:24:39.000Z"
    },
    {
      "id": "recTxhZp8XbdJeGea",
      "createdTime": "2025-10-07T15:23:06.000Z",
      "Title": "CITES AIA-ID Initiative",
      "Organizer/Chair": "China (China CITES SA: Endangered Species Scientific Commission, PRC (ESSC)",
      "Room ": "C.A.Tortoise (40)",
      "start date": "26/11/2025",
      "Start Time - sort": "2025-11-26T16:15:00.000Z",
      "End": "18:45",
      "Description of the side event": "Share the significant progress achieved, including the gap analysis; Demonstrate real-time queries using the CITES AIA-ID Navigator; Invite collaboration through an expert panel and additional image datasets; ",
      "Start": "17:15",
      "Type": [
        "Side event"
      ],
      "Start date - Panamanian date": "26/11/2025",
      "Start time - Panamanian Time": "17:15",
      "Last Modified": "2025-11-07T15:25:48.000Z"
    },
    {
      "id": "recUDssZSmdYJ76p3",
      "createdTime": "2025-10-07T15:23:06.000Z",
      "Title": "Biodiversity degradation in Uzbekistan under climate change and the unsustainable use of ecosystem resources to secure environmental and national security of the region",
      "Organizer/Chair": "Research Institute of Environmental and Nature Conservation Technologies under the Ministry of Ecology, Environmental Protection and Climate Change",
      "Room ": "C.A.Tortoise (40)",
      "start date": "28/11/2025",
      "Start Time - sort": "2025-11-28T11:15:00.000Z",
      "End": "13:45",
      "Description of the side event": "Biodiversity degradation in Uzbekistan under climate change and the unsustainable use of ecosystem resources to secure environmental and national security of the region ",
      "Start": "12:15",
      "Type": [
        "Side event"
      ],
      "Start date - Panamanian date": "28/11/2025",
      "Start time - Panamanian Time": "12:15",
      "Last Modified": "2025-11-07T15:25:48.000Z"
    },
    {
      "id": "recUPA7iCNYmzzJNo",
      "createdTime": "2025-10-07T15:23:06.000Z",
      "Title": "Forensics: a CITES tool",
      "Organizer/Chair": "UNODC - ICCWC",
      "Room ": "Bukahra D. (120)",
      "start date": "28/11/2025",
      "Start Time - sort": "2025-11-28T11:15:00.000Z",
      "End": "13:45",
      "Description of the side event": "Address the potential for wildlife forensic techniques to support the legal trade of wildlife by ensuring that wildlife products are certified legally sourced, captive bred or free from wild sourced laundering. ",
      "Start": "12:15",
      "Type": [
        "Side event"
      ],
      "Start date - Panamanian date": "28/11/2025",
      "Start time - Panamanian Time": "12:15",
      "Last Modified": "2025-11-17T12:26:11.000Z"
    },
    {
      "id": "recUpVkj5QGb9a31S",
      "createdTime": "2025-10-07T15:23:06.000Z",
      "Title": "Fish Maw Trade Impacts ",
      "Organizer/Chair": "Animal Welfare Institute. Co-hosts: BLOOM HK, Center for Biological Diversity, Environmental Investigation Agency, IUCN Croaker and Drum Specialist Group, Natural Resources Defense Council, Wildlife Conservation Society.",
      "Room ": "Markhor S. (70)",
      "start date": "29/11/2025",
      "Start Time - sort": "2025-11-29T16:15:00.000Z",
      "End": "18:45",
      "Description of the side event": "A panel of experts will explore the global scope of the fish maw trade, how it is affecting CITES-listed and other species, the urgent need for regulation of fisheries and trade, and the potential for collaboration between CITES and other intergovernmental organizations. They will discuss how CITES can provide a leadership role to improve the sustainability and traceability of the fish maw trade. ",
      "Start": "17:15",
      "Type": [
        "Side event"
      ],
      "Start date - Panamanian date": "29/11/2025",
      "Start time - Panamanian Time": "17:15",
      "Last Modified": "2025-11-07T15:25:48.000Z"
    },
    {
      "id": "recVWDG5Glg2Rj1Ro",
      "createdTime": "2025-10-07T15:23:06.000Z",
      "Title": "Catalyzing ecosystem restoriation in Uzbekistan: launch of the GEF-8 ERIP Project",
      "Organizer/Chair": "Ministry of Ecology, Environmental Protection and Climate Change of the Republic of Uzbekistan, GEF, IUCN, UNDP.",
      "Room ": "Caracal (Press)",
      "start date": "25/11/2025",
      "Start Time - sort": "2025-11-25T11:30:00.000Z",
      "End": "14:00",
      "Description of the side event": "Catalyzing ecosystem restoriation in Uzbekistan: launch of the GEF-8 ERIP Project",
      "Start": "12:30",
      "Type": [
        "Side event"
      ],
      "Start date - Panamanian date": "25/11/2025",
      "Start time - Panamanian Time": "12:30",
      "Last Modified": "2025-11-07T15:25:48.000Z"
    },
    {
      "id": "recWLSe4v3SWuFvAX",
      "createdTime": "2025-10-07T15:23:06.000Z",
      "Title": "A CMS Global Initiative",
      "Organizer/Chair": "Convention on the Conservation of Migratory Species (with UZBEKISTAN, TURKMENISTAN, CPW and WCS)",
      "Room ": "Markhor S. (70)",
      "start date": "28/11/2025",
      "Start Time - sort": "2025-11-28T18:00:00.000Z",
      "End": "20:30",
      "Description of the side event": "Present the Global Initiative on Illegal and Unsustainable Taking of Species at the National Level, a collaborative response under the Convention on Migratory Species (CMS) to a major but often overlooked threat—domestic taking of wildlife for local use, trade, cultural or other purposes. ",
      "Start": "19:00",
      "Type": [
        "Side event"
      ],
      "Start date - Panamanian date": "28/11/2025",
      "Start time - Panamanian Time": "19:00",
      "Last Modified": "2025-11-07T15:25:48.000Z"
    },
    {
      "id": "recWaj63HXyJxbHsI",
      "createdTime": "2025-10-07T15:23:06.000Z",
      "Title": "What works to stop IWT?",
      "Organizer/Chair": "UNODC",
      "Room ": "S.Falcon (70)",
      "start date": "27/11/2025",
      "Start Time - sort": "2025-11-27T18:00:00.000Z",
      "End": "20:30",
      "Description of the side event": "Understanding what effectively reduces wildlife trafficking is essential for a wide range of stakeholders, including policymakers, regulatory and enforcement authorities, and funding institutions. Evidence-based knowledge can guide the prioritization, targeting, evaluation, and refinement of interventions aimed at combating wildlife trafficking. ",
      "Start": "19:00",
      "Type": [
        "Side event"
      ],
      "Start date - Panamanian date": "27/11/2025",
      "Start time - Panamanian Time": "19:00",
      "Last Modified": "2025-11-07T15:23:02.000Z"
    },
    {
      "id": "recXO5mmjqSdcrutk",
      "createdTime": "2025-11-17T11:16:29.000Z",
      "Title": "Eightieth meeting of the Standing Committee (SC80)",
      "Room ": "Argali (Com I)",
      "start date": "5/12/2025",
      "Start Time - sort": "2025-12-05T13:00:00.000Z",
      "End": "17:00",
      "Start": "14:00",
      "Type": [
        "Main mtg"
      ],
      "Start date - Panamanian date": "5/12/2025",
      "Start time - Panamanian Time": "14:00",
      "Last Modified": "2025-11-17T11:29:12.000Z"
    },
    {
      "id": "recXxrBkssp9jPZOZ",
      "createdTime": "2025-10-07T15:23:06.000Z",
      "Title": "Conservation of Lions",
      "Organizer/Chair": "India",
      "Room ": "S.Falcon (70)",
      "start date": "3/12/2025",
      "Start Time - sort": "2025-12-03T16:15:00.000Z",
      "End": "18:45",
      "Description of the side event": "Will have experts, Government officials, etc, presenting on the different  ",
      "Start": "17:15",
      "Type": [
        "Side event"
      ],
      "Start date - Panamanian date": "3/12/2025",
      "Start time - Panamanian Time": "17:15",
      "Last Modified": "2025-11-07T15:25:48.000Z"
    },
    {
      "id": "recY2mBm0r6SVGaMb",
      "createdTime": "2025-10-07T15:23:06.000Z",
      "Title": "BBNJ Agreement & CITES",
      "Organizer/Chair": "Co-hosted by the CITES Secretariat and the Division for Ocean Affairs and the Law of the Sea (DOALOS) of the Office of Legal Affairs of the United Nations and the CITES Secretariat",
      "Room ": "Bukahra D. (120)",
      "start date": "28/11/2025",
      "Start Time - sort": "2025-11-28T18:00:00.000Z",
      "End": "20:30",
      "Description of the side event": "This side event aims to promote a better understanding of the BBNJ Agreement and opportunities it provides to support the achievement of the objectives of CITES, and to explore synergies between the two instruments, as well as opportunities and challenges to leverage such synergies. ",
      "Start": "19:00",
      "Type": [
        "Side event"
      ],
      "Start date - Panamanian date": "28/11/2025",
      "Start time - Panamanian Time": "19:00",
      "Last Modified": "2025-11-07T15:24:39.000Z"
    },
    {
      "id": "recY66wbsZczCsar6",
      "createdTime": "2025-10-07T15:23:06.000Z",
      "Title": "A Decade of Demand Reduction",
      "Organizer/Chair": "TRAFFIC - co-hosted with the German\n government through BMUKN",
      "Room ": "Markhor S. (70)",
      "start date": "29/11/2025",
      "Start Time - sort": "2025-11-29T11:15:00.000Z",
      "End": "13:45",
      "Description of the side event": "Review highlights, success stories, challenges and lessons learned from efforts to reduce demand for CITES-listed species, whilst also engaging expert opinion over what this might mean for market mitigation measures moving forward ",
      "Start": "12:15",
      "Type": [
        "Side event"
      ],
      "Start date - Panamanian date": "29/11/2025",
      "Start time - Panamanian Time": "12:15",
      "Last Modified": "2025-11-07T15:24:39.000Z"
    },
    {
      "id": "recYfc8Y1OsGu6Boh",
      "createdTime": "2025-11-16T13:32:28.000Z",
      "Title": "Credentials Committee ",
      "Organizer/Chair": "Credentials Committee",
      "Room ": "L. Orchid",
      "start date": "24/11/2025",
      "Start Time - sort": "2025-11-24T09:12:00.000Z",
      "End": "12:00",
      "Start": "10:12",
      "Type": [
        "Other"
      ],
      "Start date - Panamanian date": "24/11/2025",
      "Start time - Panamanian Time": "10:12",
      "Last Modified": "2025-11-17T11:09:04.000Z"
    },
    {
      "id": "recYxAZCdYGarlpK2",
      "createdTime": "2025-10-07T15:23:06.000Z",
      "Title": "GWP: CITES synergies",
      "Organizer/Chair": "World Bank as lead agency of Global Wildlife Program. GWP is funded by the GEF with partners, UNDP, UNEP, ADB, IUCN, WWF, CI, TRAFFIC, CITES Secretariat, CMS Secretariat, WCS, TRAFFIC and WildAid. ",
      "Room ": "Eulophia D. (70)",
      "start date": "24/11/2025",
      "Start Time - sort": "2025-11-24T12:00:00.000Z",
      "End": "14:30",
      "Description of the side event": "This event will explore these synergies between GWP and CITES implementation. It will showcase examples from Parties on how their GWP national projects are addressing the drivers of illegal and unsustainable trade and supporting CITES implementation, and profile GWP work on behavior change and collaboration with ICCWC on counter wildlife trafficking. ",
      "Start": "13:00",
      "Type": [
        "Side event"
      ],
      "Start date - Panamanian date": "24/11/2025",
      "Start time - Panamanian Time": "13:00",
      "Last Modified": "2025-11-12T11:50:07.000Z"
    },
    {
      "id": "recZ5GCag2OQ4y91O",
      "createdTime": "2025-10-07T15:23:06.000Z",
      "Title": "Tiger trade & the law ",
      "Organizer/Chair": "TRAFFIC along with WWF and Legal Atlas ",
      "Room ": "Saiga A. (120)",
      "start date": "25/11/2025",
      "Start Time - sort": "2025-11-25T11:15:00.000Z",
      "End": "13:45",
      "Description of the side event": "This side event will present key findings and recommendations from the latest Skin and Bones report, drawing on 25 years of seizure data across tiger range countries.  ",
      "Start": "12:15",
      "Type": [
        "Side event"
      ],
      "Start date - Panamanian date": "25/11/2025",
      "Start time - Panamanian Time": "12:15",
      "Last Modified": "2025-11-07T15:25:48.000Z"
    },
    {
      "id": "recZDUGmiVB9oa2Zq",
      "createdTime": "2025-10-29T14:20:41.000Z",
      "Title": "Samarkand Declaration",
      "Organizer/Chair": "Ministry of Ecology, Environmental Protection and Climate Change of the Republic of Uzbekistan, co-hosted with TRAFFIC",
      "Room ": "Saiga A. (120)",
      "start date": "24/11/2025",
      "Start Time - sort": "2025-11-24T12:00:00.000Z",
      "End": "14:30",
      "Description of the side event": "This session will introduce the state of wildlife trade in the region, based on the TRAFFIC report, and priorities for action. It will highlight the political will and shared vision among the five Central Asian nations to safeguard biodiversity, enable legal and sustainable trade, and dismantle transboundary trafficking networks. It will also offer a platform for dialogue with CITES Parties and partners on opportunities for collaborative implementation, technical assistance, and investment in community-based conservation. ",
      "Start": "13:00",
      "Type": [
        "Side event"
      ],
      "Start date - Panamanian date": "24/11/2025",
      "Start time - Panamanian Time": "13:00",
      "Last Modified": "2025-11-12T11:50:16.000Z"
    },
    {
      "id": "recZMfQWwTmJhArjK",
      "createdTime": "2025-10-31T16:09:15.000Z",
      "Title": "Committee II",
      "Room ": "Rhodiola S. (Com II)",
      "start date": "29/11/2025",
      "Start Time - sort": "2025-11-29T08:00:00.000Z",
      "End": "12:00",
      "Start": "09:00",
      "Type": [
        "Main mtg"
      ],
      "Start date - Panamanian date": "29/11/2025",
      "Start time - Panamanian Time": "09:00",
      "Last Modified": "2025-10-31T16:21:59.000Z"
    },
    {
      "id": "recZQhsl50xVWRPCb",
      "createdTime": "2025-10-07T15:23:06.000Z",
      "Title": "Trade in endemic species",
      "Organizer/Chair": "Brazil and Ecuador",
      "Room ": "S.Falcon (70)",
      "start date": "26/11/2025",
      "Start Time - sort": "2025-11-26T11:15:00.000Z",
      "End": "13:45",
      "Description of the side event": "Address the problem of trade in endemic species without proof of legal export from the country of origin – where the species naturally occurs and where they are often specially protected. The consequences of this trade for wild populations will be analyzed, as well as possible CITES mechanisms that can solve this problem. ",
      "Start": "12:15",
      "Type": [
        "Side event"
      ],
      "Start date - Panamanian date": "26/11/2025",
      "Start time - Panamanian Time": "12:15",
      "Last Modified": "2025-11-07T15:25:48.000Z"
    },
    {
      "id": "recZqcRkg9sakfDau",
      "createdTime": "2025-10-07T15:23:06.000Z",
      "Title": "Saiga: new challenges",
      "Organizer/Chair": "The Ministry of Ecology and Natural Resources of the Republic of Kazakhstan and the Ministry of ecology, environmental protection and climate change of the Republic of Uzbekistan",
      "Room ": "S.Falcon (70)",
      "start date": "24/11/2025",
      "Start Time - sort": "2025-11-24T17:30:00.000Z",
      "End": "20:00",
      "Description of the side event": "Present scientific data on population dynamics, the socio-economic impacts of overabundance, and Kazakhstan’s rationale for lifting the zero export quota under CITES. Special attention will be given to transboundary cooperation with Uzbekistan and other range states, as well as ensuring that any potential future use remains legal, traceable, and biologically sustainable. ",
      "Start": "18:30",
      "Type": [
        "Side event"
      ],
      "Start date - Panamanian date": "24/11/2025",
      "Start time - Panamanian Time": "18:30",
      "Last Modified": "2025-11-14T10:50:44.000Z"
    },
    {
      "id": "reca5nBErLMv99Jj8",
      "createdTime": "2025-10-07T15:23:06.000Z",
      "Title": "Tarántulas en Ap. II ",
      "Organizer/Chair": "Argentina, Bolivia, Panamá, AWI y SSN",
      "Room ": "S.Falcon (70)",
      "start date": "3/12/2025",
      "Start Time - sort": "2025-12-03T11:15:00.000Z",
      "End": "13:45",
      "Description of the side event": "Analyse the current state of trade in tarantulas and other terrestrial invertebrates, its implications for biodiversity, and opportunities to improve its management and regulation. Discussions will focus on challenges in traceability and the role of instruments such as CITES in ensuring that international trade does not threaten the survival of these species.  ",
      "Start": "12:15",
      "Type": [
        "Side event"
      ],
      "Start date - Panamanian date": "3/12/2025",
      "Start time - Panamanian Time": "12:15",
      "Last Modified": "2025-11-07T15:25:48.000Z"
    },
    {
      "id": "reca7fEwXialVCTJl",
      "createdTime": "2025-10-07T15:23:06.000Z",
      "Title": "CITES' effectiveness",
      "Organizer/Chair": "IUCN Sustainable Use and Livelihoods Specialist Group",
      "Room ": "Bukahra D. (120)",
      "start date": "29/11/2025",
      "Start Time - sort": "2025-11-29T11:15:00.000Z",
      "End": "13:45",
      "Description of the side event": "It will focus on recognizing CITES successes and then evaluating how the Convention could be more successful. There will be a small number of presentations followed by a panel discussion and a broader discussion with attendees. The event relates to agenda items 13, 27, 29, 76, 84 and 114 (Proposals to amend Appendices I and II). ",
      "Start": "12:15",
      "Type": [
        "Side event"
      ],
      "Start date - Panamanian date": "29/11/2025",
      "Start time - Panamanian Time": "12:15",
      "Last Modified": "2025-11-07T15:24:04.000Z"
    },
    {
      "id": "recaPwMMtcdxhIklo",
      "createdTime": "2025-10-07T15:23:06.000Z",
      "Title": "Ensuring Legality and Sustainability of the Live Wild Animal Trade in Central Asia",
      "Organizer/Chair": "TRAFFIC International ",
      "Room ": "Bukahra D. (120)",
      "start date": "4/12/2025",
      "Start Time - sort": "2025-12-04T16:15:00.000Z",
      "End": "18:45",
      "Description of the side event": "Seeks to raise awareness, foster dialogue, and build partnerships that support sustainable and legal trade while safeguarding biodiversity. It will be of interest to CITES Parties, enforcement agencies, NGOs, and researchers focused on wildlife trade and conservation in emerging and understudied regions. ",
      "Start": "17:15",
      "Type": [
        "Side event"
      ],
      "Start date - Panamanian date": "4/12/2025",
      "Start time - Panamanian Time": "17:15",
      "Last Modified": "2025-11-12T13:10:54.000Z"
    },
    {
      "id": "recahl1rb4CA2w9t5",
      "createdTime": "2025-10-07T15:23:06.000Z",
      "Title": "EU Timber Imports",
      "Organizer/Chair": "European Union",
      "Room ": "Bukahra D. (120)",
      "start date": "26/11/2025",
      "Start Time - sort": "2025-11-26T18:00:00.000Z",
      "End": "20:30",
      "Description of the side event": "The EU will present its draft guidance, which is intended to be used by the Scientific Authorities of EU Member States when conducting NDFs for timber species listed under CITES. There will be opportunities for questions and feedback on the draft guidance. ",
      "Start": "19:00",
      "Type": [
        "Side event"
      ],
      "Start date - Panamanian date": "26/11/2025",
      "Start time - Panamanian Time": "19:00",
      "Last Modified": "2025-11-07T15:25:48.000Z"
    },
    {
      "id": "recb2KE3cjFisK2d5",
      "createdTime": "2025-11-17T11:14:44.000Z",
      "Title": "Plenary - ",
      "Room ": "Argali (Com I)",
      "start date": "4/12/2025",
      "Start Time - sort": "2025-12-04T13:00:00.000Z",
      "End": "17:00",
      "Start": "14:00",
      "Type": [
        "Main mtg"
      ],
      "Start date - Panamanian date": "4/12/2025",
      "Start time - Panamanian Time": "14:00",
      "Last Modified": "2025-11-17T11:18:21.000Z"
    },
    {
      "id": "recb9y5L9YWjRxVFI",
      "createdTime": "2025-10-07T15:23:06.000Z",
      "Title": "Pangolin Trade in China",
      "Organizer/Chair": "Environmental Investigation Agency UK (EIA UK)",
      "Room ": "Eulophia D. (70)",
      "start date": "25/11/2025",
      "Start Time - sort": "2025-11-25T11:15:00.000Z",
      "End": "13:45",
      "Description of the side event": "Present the findings of research on Chinese court cases relating to the illegal trade of pangolins. The themes of discussion will be legal domestic markets for pangolins in China, the sourcing of pangolins in illegal trade, routes and methods that are used for illegal smuggling, and strengths and weaknesses in regulation, enforcement and prosecution. ",
      "Start": "12:15",
      "Type": [
        "Side event"
      ],
      "Start date - Panamanian date": "25/11/2025",
      "Start time - Panamanian Time": "12:15",
      "Last Modified": "2025-11-07T15:25:48.000Z"
    },
    {
      "id": "recbODSd4YInvscAG",
      "createdTime": "2025-10-29T14:20:41.000Z",
      "Title": "Global Songbird Crisis",
      "Organizer/Chair": "Sustainable Innovation Initiatives (SII) and co-hosts, including the IUCN SSC ASTSG, EAZA, BirdLife International, Monitor, Creative Conservation Lab, and the newly forming Neotropical Songbirds Collaborative Group. ",
      "Room ": "S.Falcon (70)",
      "start date": "2/12/2025",
      "Start Time - sort": "2025-12-02T18:00:00.000Z",
      "End": "20:30",
      "Description of the side event": "Highlight case studies from Asia, Europe, Africa, the Middle East, and the Neotropics, enriched by regional songbird sights and sounds. Experts will share insights into the cultural drivers of trade, effective regulatory approaches, policy interventions, and practical conservation solutions. ",
      "Start": "19:00",
      "Type": [
        "Side event"
      ],
      "Start date - Panamanian date": "2/12/2025",
      "Start time - Panamanian Time": "19:00",
      "Last Modified": "2025-11-07T15:25:48.000Z"
    },
    {
      "id": "recbdhfhBbMEyw0yg",
      "createdTime": "2025-10-07T15:23:06.000Z",
      "Title": "Wildlife Economy",
      "Organizer/Chair": "The international Council for Game and Wildlife \nConservation (CIC) and Sustainable Use Organizations Network",
      "Room ": "Bukahra D. (120)",
      "start date": "29/11/2025",
      "Start Time - sort": "2025-11-29T16:15:00.000Z",
      "End": "18:45",
      "Description of the side event": "As the scope of CITES continues to expand, there is a growing concern that its core mission—ensuring that international trade in wild species is legal, sustainable, and traceable—risks being diluted. This side event will provide a space to critically examine the current agenda and assess how to realign priorities with the Convention's foundational goals. ",
      "Start": "17:15",
      "Type": [
        "Side event"
      ],
      "Start date - Panamanian date": "29/11/2025",
      "Start time - Panamanian Time": "17:15",
      "Last Modified": "2025-11-07T15:25:48.000Z"
    },
    {
      "id": "recc0VkUXj9CQnRky",
      "createdTime": "2025-10-07T15:23:06.000Z",
      "Title": "United for Big Cats",
      "Organizer/Chair": "Go Insight, co-hosted with the International Big Cat Alliance and the South Asian Wildlife Enforcement Network ",
      "Room ": "Bukahra D. (120)",
      "start date": "4/12/2025",
      "Start Time - sort": "2025-12-04T18:00:00.000Z",
      "End": "20:30",
      "Description of the side event": "This event will highlight the importance of: \n\nTransnational and multi-sectoral partnerships; \nRegional coordination mechanisms; \nData-driven intelligence ",
      "Start": "19:00",
      "Type": [
        "Side event"
      ],
      "Start date - Panamanian date": "4/12/2025",
      "Start time - Panamanian Time": "19:00",
      "Last Modified": "2025-11-07T15:24:39.000Z"
    },
    {
      "id": "reccMY6CARn3diKO9",
      "createdTime": "2025-10-31T16:07:46.000Z",
      "Title": "Committee II",
      "Room ": "Rhodiola S. (Com II)",
      "start date": "27/11/2025",
      "Start Time - sort": "2025-11-27T08:00:00.000Z",
      "End": "12:00",
      "Start": "09:00",
      "Type": [
        "Main mtg"
      ],
      "Start date - Panamanian date": "27/11/2025",
      "Start time - Panamanian Time": "09:00",
      "Last Modified": "2025-10-31T16:21:55.000Z"
    },
    {
      "id": "reccXmsY8czzATRrg",
      "createdTime": "2025-10-07T15:23:06.000Z",
      "Title": "SSN/Bavin Awards Event",
      "Organizer/Chair": "Species Survival Network",
      "Room ": "Saiga A. (120)",
      "start date": "2/12/2025",
      "Start Time - sort": "2025-12-02T16:15:00.000Z",
      "End": "18:45",
      "Description of the side event": "Emphasizes collaboration across producer, transit, and consumer states: aligning science, closing loopholes, and strengthening shared knowledge. ",
      "Start": "17:15",
      "Type": [
        "Side event"
      ],
      "Start date - Panamanian date": "2/12/2025",
      "Start time - Panamanian Time": "17:15",
      "Last Modified": "2025-11-07T15:25:48.000Z"
    },
    {
      "id": "recdQ4LqwkhOHo09S",
      "createdTime": "2025-10-07T15:23:06.000Z",
      "Title": "Illegal Sloth Trade LA",
      "Organizer/Chair": "Costa Rica- Brazil – Panama - Peru with support of Species Survival Network, Humane World for Animals, and IFAW (Event is co-hosted)",
      "Room ": "S.Falcon (70)",
      "start date": "29/11/2025",
      "Start Time - sort": "2025-11-29T11:15:00.000Z",
      "End": "13:45",
      "Description of the side event": "Bring together technical experts, law enforcement authorities, and international specialists to shed light on this growing crisis, present key evidence, and support the proposal to list both species in Appendix II of CITES. This measure aims to strengthen trade regulation and assist range states in their conservation efforts. ",
      "Start": "12:15",
      "Type": [
        "Side event"
      ],
      "Start date - Panamanian date": "29/11/2025",
      "Start time - Panamanian Time": "12:15",
      "Last Modified": "2025-11-12T10:59:18.000Z"
    },
    {
      "id": "recdTdbEfBZxeM1ud",
      "createdTime": "2025-10-07T15:23:06.000Z",
      "Title": "Stronger Together",
      "Organizer/Chair": "Convention on Migratory Species ",
      "Room ": "S.Falcon (70)",
      "start date": "25/11/2025",
      "Start Time - sort": "2025-11-25T11:15:00.000Z",
      "End": "13:45",
      "Description of the side event": "Spotlight key achievements and collaborative efforts under the CITES-CMS JPW, 2021–2025, reinforcing the importance of synergies between the two Conventions in addressing the conservation status of species listed under both Conventions.",
      "Start": "12:15",
      "Type": [
        "Side event"
      ],
      "Start date - Panamanian date": "25/11/2025",
      "Start time - Panamanian Time": "12:15",
      "Last Modified": "2025-11-07T15:25:48.000Z"
    },
    {
      "id": "recdh7Tw9dEF0BJT8",
      "createdTime": "2025-10-07T15:23:06.000Z",
      "Title": "A Documentary on Chinese Pangolin Conservation",
      "Organizer/Chair": "China Wildlife Conservation Association, WildAid",
      "Room ": "Markhor S. (70)",
      "start date": "28/11/2025",
      "Start Time - sort": "2025-11-28T16:15:00.000Z",
      "End": "18:45",
      "Description of the side event": "Screening of the film DEFENDERS OF THE HIDDEN ",
      "Start": "17:15",
      "Type": [
        "Side event"
      ],
      "Start date - Panamanian date": "28/11/2025",
      "Start time - Panamanian Time": "17:15",
      "Last Modified": "2025-11-07T15:25:48.000Z"
    },
    {
      "id": "receE2eRpD0YCgTg6",
      "createdTime": "2025-10-07T15:23:06.000Z",
      "Title": "Primates Trafficking",
      "Organizer/Chair": "Legal Atlas (co-hosting with Gov of Uganda, PASA and IFAW)",
      "Room ": "S.Falcon (70)",
      "start date": "4/12/2025",
      "Start Time - sort": "2025-12-04T11:15:00.000Z",
      "End": "13:45",
      "Description of the side event": "Launches the proposal submitted to CITES by the Government of Uganda for the creation of a CITES Great Apes Enforcement Task Force. Supporting the initiative, legal and conservation organizations will provide the latest insights on the trade in live great apes, as well as new tools available in support of legal develoent and law enforcement. ",
      "Start": "12:15",
      "Type": [
        "Side event"
      ],
      "Start date - Panamanian date": "4/12/2025",
      "Start time - Panamanian Time": "12:15",
      "Last Modified": "2025-11-07T15:25:48.000Z"
    },
    {
      "id": "receYGagiiH9KAsNm",
      "createdTime": "2025-11-17T11:07:16.000Z",
      "Title": "Seventy-ninth meeting of the Standing Committee (SC79)",
      "Room ": "Argali (Com I)",
      "start date": "23/11/2025",
      "Start Time - sort": "2025-11-23T13:00:00.000Z",
      "End": "17:00",
      "Start": "14:00",
      "Type": [
        "Main mtg"
      ],
      "Start date - Panamanian date": "23/11/2025",
      "Start time - Panamanian Time": "14:00",
      "Last Modified": "2025-11-17T11:09:09.000Z"
    },
    {
      "id": "recfP9Zztn1sgYY1d",
      "createdTime": "2025-11-14T12:41:03.000Z",
      "Title": "Opening Press Conference",
      "Organizer/Chair": "CITES Secretariat and Uzbekistan\n",
      "Room ": "Caracal (Press)",
      "start date": "24/11/2025",
      "Start Time - sort": "2025-11-24T17:00:00.000Z",
      "End": "18:45",
      "Start": "18:00",
      "Type": [
        "Other"
      ],
      "Start date - Panamanian date": "24/11/2025",
      "Start time - Panamanian Time": "18:00",
      "Last Modified": "2025-11-18T13:52:47.000Z"
    },
    {
      "id": "recfpZS036r0Vh7Vl",
      "createdTime": "2025-10-07T15:23:06.000Z",
      "Title": "Hunting trophies policy",
      "Organizer/Chair": "IUCN Sustainable Use and Livelihoods Specialist Group",
      "Room ": "Bukahra D. (120)",
      "start date": "27/11/2025",
      "Start Time - sort": "2025-11-27T18:00:00.000Z",
      "End": "20:30",
      "Description of the side event": "Present analyses of trophy hunting, the threat to species from trophy hunting, and implications for policymaking, and draws on trophy hunting of African rhinoceroses as a case study.  ",
      "Start": "19:00",
      "Type": [
        "Side event"
      ],
      "Start date - Panamanian date": "27/11/2025",
      "Start time - Panamanian Time": "19:00",
      "Last Modified": "2025-11-07T15:23:02.000Z"
    },
    {
      "id": "recgIWhshNiUQAzOQ",
      "createdTime": "2025-11-18T11:39:41.000Z",
      "Title": "CITES Secretariat - ICCWC - Closed Meeting",
      "Organizer/Chair": "CITES Secretariat - ICCWC - Closed Meeting",
      "Room ": "D. Monitor (32)",
      "start date": "25/11/2025",
      "Start Time - sort": "2025-11-25T08:30:00.000Z",
      "End": "12:00",
      "Description of the side event": "CITES Secretariat - ICCWC - Closed Meeting",
      "Start": "09:30",
      "Type": [
        "Other"
      ],
      "Start date - Panamanian date": "25/11/2025",
      "Start time - Panamanian Time": "09:30",
      "Last Modified": "2025-11-18T11:41:38.000Z"
    },
    {
      "id": "recgPaG4HM2CsOL4Z",
      "createdTime": "2025-10-31T16:09:11.000Z",
      "Title": "Committee I",
      "Room ": "Argali (Com I)",
      "start date": "29/11/2025",
      "Start Time - sort": "2025-11-29T08:00:00.000Z",
      "End": "12:00",
      "Start": "09:00",
      "Type": [
        "Main mtg"
      ],
      "Start date - Panamanian date": "29/11/2025",
      "Start time - Panamanian Time": "09:00",
      "Last Modified": "2025-10-31T16:21:30.000Z"
    },
    {
      "id": "recgPtneMKWbe0tOr",
      "createdTime": "2025-10-31T16:07:41.000Z",
      "Title": "Committee I",
      "Room ": "Argali (Com I)",
      "start date": "27/11/2025",
      "Start Time - sort": "2025-11-27T08:00:00.000Z",
      "End": "12:00",
      "Start": "09:00",
      "Type": [
        "Main mtg"
      ],
      "Start date - Panamanian date": "27/11/2025",
      "Start time - Panamanian Time": "09:00",
      "Last Modified": "2025-10-31T16:21:19.000Z"
    },
    {
      "id": "rech4T98PxglyOyLE",
      "createdTime": "2025-10-07T15:23:06.000Z",
      "Title": "African Forest and Savanna Elephants: Update of the Status Report",
      "Organizer/Chair": "IUCN SSC African Elephant Specialist Group",
      "Room ": "Bukahra D. (120)",
      "start date": "3/12/2025",
      "Start Time - sort": "2025-12-03T16:15:00.000Z",
      "End": "18:45",
      "Description of the side event": "Present two landmark publications: the African Forest Elephant Status Report (AFESR) and the African Savanna Elephant Status Report (ASESR). These are the first separate reports since the recognition in 2021 of Loxodonta cyclotis and Loxodonta africana as distinct species, based on robust genetic, ecological, and morphological evidence. ",
      "Start": "17:15",
      "Type": [
        "Side event"
      ],
      "Start date - Panamanian date": "3/12/2025",
      "Start time - Panamanian Time": "17:15",
      "Last Modified": "2025-11-07T15:25:48.000Z"
    },
    {
      "id": "rechf9bfvrNq0OqEu",
      "createdTime": "2025-10-07T15:23:06.000Z",
      "Title": "Trade in frogs’ legs",
      "Organizer/Chair": "Pro Wildlife",
      "Room ": "Markhor S. (70)",
      "start date": "28/11/2025",
      "Start Time - sort": "2025-11-28T11:15:00.000Z",
      "End": "13:45",
      "Description of the side event": "Present the scope and ecological impact of the international trade in frog legs. ",
      "Start": "12:15",
      "Type": [
        "Side event"
      ],
      "Start date - Panamanian date": "28/11/2025",
      "Start time - Panamanian Time": "12:15",
      "Last Modified": "2025-11-07T15:25:48.000Z"
    },
    {
      "id": "rechiRC3jONKjW6fe",
      "createdTime": "2025-11-14T17:13:08.000Z",
      "Title": "Bureau Meeting",
      "Organizer/Chair": "CoP20 Bureau",
      "Room ": "L. Orchid",
      "start date": "4/12/2025",
      "Start Time - sort": "2025-12-04T16:00:00.000Z",
      "End": "17:30",
      "Start": "17:00",
      "Type": [
        "Other"
      ],
      "Start date - Panamanian date": "4/12/2025",
      "Start time - Panamanian Time": "17:00",
      "Last Modified": "2025-11-14T17:13:16.000Z"
    },
    {
      "id": "rechtgOsejRF5jKLt",
      "createdTime": "2025-10-07T15:23:06.000Z",
      "Title": "CGYN",
      "Organizer/Chair": "Singapore",
      "Room ": "C.A.Tortoise (40)",
      "start date": "27/11/2025",
      "Start Time - sort": "2025-11-27T11:15:00.000Z",
      "End": "13:45",
      "Description of the side event": "\"This session examines how to meaningfully integrate youth into conservation efforts at national and international levels, focusing on their role in legal and sustainable wildlife trade.\n\nWe'll explore the evolution of the CITES Global Youth Network (CGYN), showcasing how young people worldwide helped shape its vision, mission and projects through two key Singapore-based events: the CITES Youth Leadership Programme and the CITES Global Youth Summit.\n\nYouth representatives will share their experiences in mobilising grassroots action and contributing to sustainable wildlife trade through the Network.\n\nJoin us to discuss how wildlife trade governance could transform when young people are empowered to lead rather than merely participate.\"",
      "Start": "12:15",
      "Type": [
        "Side event"
      ],
      "Start date - Panamanian date": "27/11/2025",
      "Start time - Panamanian Time": "12:15",
      "Last Modified": "2025-11-07T15:23:02.000Z"
    },
    {
      "id": "rechv3WKiqzJmjxuu",
      "createdTime": "2025-10-29T14:20:31.000Z",
      "Title": "Civil Society sharing wildlife crime information with law enforcement ",
      "Organizer/Chair": "United for Wildlife and the Nature Crime Alliance (with support from INTERPOL Wildlife Crime Working Group)",
      "Room ": "Saiga A. (120)",
      "start date": "29/11/2025",
      "Start Time - sort": "2025-11-29T18:00:00.000Z",
      "End": "20:30",
      "Description of the side event": "Information sharing and collaborative between law enforcement and civil society to combat wildlife crime. It will spotlight practical tools to improve coordination, build trust, and enable impactful enforcement. ",
      "Start": "19:00",
      "Type": [
        "Side event"
      ],
      "Start date - Panamanian date": "29/11/2025",
      "Start time - Panamanian Time": "19:00",
      "Last Modified": "2025-11-07T15:25:48.000Z"
    },
    {
      "id": "reci2H9JfEyycF0Wg",
      "createdTime": "2025-10-07T15:23:06.000Z",
      "Title": "ICCWC’s Impact: Showcasing Global Successes",
      "Organizer/Chair": "CITES Secretariat - ICCWC",
      "Room ": "Bukahra D. (120)",
      "start date": "26/11/2025",
      "Start Time - sort": "2025-11-26T11:15:00.000Z",
      "End": "13:45",
      "Description of the side event": "A showcase of ICCWC’s successes at national and international levels, including Parties’ experiences, the achievements of WIRE 2025 and Operation THUNDER 2025, and reflections on what works to disrupt a wildlife trafficking network.",
      "Start": "12:15",
      "Type": [
        "Side event"
      ],
      "Start date - Panamanian date": "26/11/2025",
      "Start time - Panamanian Time": "12:15",
      "Last Modified": "2025-11-17T12:17:54.000Z"
    },
    {
      "id": "reciQOJ8BgPwOKjNo",
      "createdTime": "2025-10-31T16:07:17.000Z",
      "Title": "Committee I",
      "Room ": "Argali (Com I)",
      "start date": "26/11/2025",
      "Start Time - sort": "2025-11-26T13:00:00.000Z",
      "End": "17:00",
      "Start": "14:00",
      "Type": [
        "Main mtg"
      ],
      "Start date - Panamanian date": "26/11/2025",
      "Start time - Panamanian Time": "14:00",
      "Last Modified": "2025-10-31T16:21:15.000Z"
    },
    {
      "id": "recjGiKVw3dTcf6om",
      "createdTime": "2025-10-07T15:23:06.000Z",
      "Title": "CITES NDF Guidance",
      "Organizer/Chair": "CITES Secretariat",
      "Room ": "Markhor S. (70)",
      "start date": "26/11/2025",
      "Start Time - sort": "2025-11-26T18:00:00.000Z",
      "End": "20:30",
      "Description of the side event": "Present the NDF guidance developed in terms of Decision 19. 132 - 19.134 including case studies presented by Parties on the use of the guidance.  ",
      "Start": "19:00",
      "Type": [
        "Side event"
      ],
      "Start date - Panamanian date": "26/11/2025",
      "Start time - Panamanian Time": "19:00",
      "Last Modified": "2025-11-14T11:46:45.000Z"
    },
    {
      "id": "recjOik219MpwORdr",
      "createdTime": "2025-10-07T15:23:06.000Z",
      "Title": "Silk Road's small cats",
      "Organizer/Chair": "CO-HOSTS: The Pallas's cat International Conservation Alliance (PICA) / The Ministry of Ecology, Environmental Protection & Climate Change, Uzbekistan / Institute of Zoology, Academy of Sciences, Uzbekistan / Conservation X labs",
      "Room ": "S.Falcon (70)",
      "start date": "2/12/2025",
      "Start Time - sort": "2025-12-02T16:15:00.000Z",
      "End": "18:45",
      "Description of the side event": "Discuss the role of transnational collaborations between range country governments, scientific institutions and conservation authorities in raising the profile of Pallas’s cats on global conservation agenda, a model which could be replicated for other small cats.  ",
      "Start": "17:15",
      "Type": [
        "Side event"
      ],
      "Start date - Panamanian date": "2/12/2025",
      "Start time - Panamanian Time": "17:15",
      "Last Modified": "2025-11-07T15:25:48.000Z"
    },
    {
      "id": "recjdhd3kjIcHiZpV",
      "createdTime": "2025-10-07T15:23:06.000Z",
      "Title": "Sharks Protection Cop20",
      "Organizer/Chair": "Panama ",
      "Room ": "Bukahra D. (120)",
      "start date": "25/11/2025",
      "Start Time - sort": "2025-11-25T11:15:00.000Z",
      "End": "13:45",
      "Description of the side event": "Highlight regional leadership in advancing key shark and ray proposals for CITES CoP20. As the proponent of the Oceanic Whitetip Shark listing and a cosponsor of other shark and ray species, Panama will showcase the science and policy rationale behind these efforts. ",
      "Start": "12:15",
      "Type": [
        "Side event"
      ],
      "Start date - Panamanian date": "25/11/2025",
      "Start time - Panamanian Time": "12:15",
      "Last Modified": "2025-11-07T15:24:39.000Z"
    },
    {
      "id": "reck4EtFrGNqlLavJ",
      "createdTime": "2025-10-07T15:23:06.000Z",
      "Title": "Striped Hyena at Risk",
      "Organizer/Chair": "Republic of Tajikistan and Republic of Uzbekistan and The Nature And Biodiversity Conservation Union  ",
      "Room ": "Bukahra D. (120)",
      "start date": "27/11/2025",
      "Start Time - sort": "2025-11-27T16:15:00.000Z",
      "End": "18:45",
      "Description of the side event": "\"This side event, co-hosted by the Republic of Tajikistan and the Republic of Uzbekistan, will spotlight the urgent need for coordinated international action to conserve the striped hyena (Hyaena hyaena), a keystone scavenger species facing increasing threats across its range. Despite its ecological importance in controlling disease vectors and contributing to ecosystem health, the striped hyena remains underrepresented in global conservation dialogues.\n\nThe event will provide a platform to:\n\nPresent the latest data on the species’ conservation status across its transboundary range;\nExamine the role of international legal instruments, including CITES and the Convention on Migratory Species (CMS), in strengthening protection measures;\nLaunch the reassessment process for the IUCN Red List status of the striped hyena, with input from range states, experts, and conservation partners.\nBy bringing together policymakers, scientists, and civil society, this session aims to catalyze a shift in global policy perception—recognizing the striped hyena not only as a species of conservation concern but also as a vital ally in reducing zoonotic disease risks. The event will also explore opportunities for regional cooperation, funding mechanisms, and integration of the species into national biodiversity strategies.\n\nJoin us to help shape a new conservation narrative for one of the most misunderstood and ecologically valuable carnivores in the world.\"",
      "Start": "17:15",
      "Type": [
        "Side event"
      ],
      "Start date - Panamanian date": "27/11/2025",
      "Start time - Panamanian Time": "17:15",
      "Last Modified": "2025-11-07T15:23:02.000Z"
    },
    {
      "id": "reclDOIJWI98pflFP",
      "createdTime": "2025-10-31T16:08:42.000Z",
      "Title": "Committee II",
      "Room ": "Rhodiola S. (Com II)",
      "start date": "28/11/2025",
      "Start Time - sort": "2025-11-28T13:00:00.000Z",
      "End": "17:00",
      "Start": "14:00",
      "Type": [
        "Main mtg"
      ],
      "Start date - Panamanian date": "28/11/2025",
      "Start time - Panamanian Time": "14:00",
      "Last Modified": "2025-10-31T16:21:58.000Z"
    },
    {
      "id": "reclaR3xfwISF4Hx9",
      "createdTime": "2025-10-07T15:23:06.000Z",
      "Title": "African hornbills",
      "Organizer/Chair": "Nigeria.   Co-host: IUCN SSC HSG, Mabula Ground Hornbill Project MGHP, AZA. African Hornbill SAFE Programme, EAZA, Monitor Conservation Research Society (Monitor), WCS, World Association of Zoos and Aquaria (WAZA), International Bird Conservation Partnership (IBCP)",
      "Room ": "C.A.Tortoise (40)",
      "start date": "2/12/2025",
      "Start Time - sort": "2025-12-02T16:15:00.000Z",
      "End": "18:45",
      "Description of the side event": "Presenting current hornbill trade research as well as new information resources that can be used for the CITES decision-making process. ",
      "Start": "17:15",
      "Type": [
        "Side event"
      ],
      "Start date - Panamanian date": "2/12/2025",
      "Start time - Panamanian Time": "17:15",
      "Last Modified": "2025-11-07T15:25:48.000Z"
    },
    {
      "id": "reclfUVojhO5SCMKS",
      "createdTime": "2025-10-31T16:10:17.000Z",
      "Title": "Committee I",
      "Room ": "Argali (Com I)",
      "start date": "3/12/2025",
      "Start Time - sort": "2025-12-03T13:00:00.000Z",
      "End": "17:00",
      "Start": "14:00",
      "Type": [
        "Main mtg"
      ],
      "Start date - Panamanian date": "3/12/2025",
      "Start time - Panamanian Time": "14:00",
      "Last Modified": "2025-10-31T16:21:43.000Z"
    },
    {
      "id": "recn1MMcaAYpcVFoz",
      "createdTime": "2025-10-31T16:06:22.000Z",
      "Title": "Committee II",
      "Room ": "Rhodiola S. (Com II)",
      "start date": "25/11/2025",
      "Start Time - sort": "2025-11-25T13:00:00.000Z",
      "End": "17:00",
      "Start": "14:00",
      "Type": [
        "Main mtg"
      ],
      "Start date - Panamanian date": "25/11/2025",
      "Start time - Panamanian Time": "14:00",
      "Last Modified": "2025-10-31T16:21:52.000Z"
    },
    {
      "id": "recnhwSHjnbRpCCzQ",
      "createdTime": "2025-10-07T15:23:06.000Z",
      "Title": "Jaguars at a Crossroads",
      "Organizer/Chair": "Panthera co-hosted by Brazil, Mexico and the Jaguar 2030 Coordination Committee: Global Wildlife Program, Inter American Development Bank, IUCN Cat Specialist Group, Panthera, UNDP, UNEP, UNODC, WCS, World Bank, and WWF, with the CITES and CMS Secretariats",
      "Room ": "S.Falcon (70)",
      "start date": "26/11/2025",
      "Start Time - sort": "2025-11-26T16:15:00.000Z",
      "End": "18:45",
      "Description of the side event": "Range States will share how their actions on jaguars under CITES and CMS can help achieve their commitments under the CBD and Global Biodiversity Framework, among other environmental initiatives, with great significance for Indigenous Peoples and Local Communities throughout Latin America. ",
      "Start": "17:15",
      "Type": [
        "Side event"
      ],
      "Start date - Panamanian date": "26/11/2025",
      "Start time - Panamanian Time": "17:15",
      "Last Modified": "2025-11-07T15:25:48.000Z"
    },
    {
      "id": "recnoI9QP5HcGVsUM",
      "createdTime": "2025-10-07T15:23:06.000Z",
      "Title": "Rethinking Trade Data - Exploring Solutions to Strengthen Wildlife Trade Data",
      "Organizer/Chair": "Animal Advocacy and Protection (AAP); co-hosts: Dominican Republic; Eurogroup for Animals (EfA); International Fund for Animal Welfare (IFAW); Fondation Franz Weber (FFW) ",
      "Room ": "C.A.Tortoise (40)",
      "start date": "27/11/2025",
      "Start Time - sort": "2025-11-27T16:15:00.000Z",
      "End": "18:45",
      "Description of the side event": "\"Exploring solutions to strengthen wildlife trade data\n\nMonitoring global wildlife trade remains challenging due to inconsistent data, limited species information, and fragmented systems. This side event brings together global experts to evaluate strengths and gaps in existing trade monitoring tools like LEMIS (USA) and TRACES (EU), and explore how these systems can be improved.\n\nExamine how effective current tools are to track wildlife in trade, and the impact of data gaps on species conservation and listing proposals. Panelists will share case studies, assess the strengths and weaknesses of existing databases, and propose practical recommendations.\n\nThe discussion will also explore how enhanced data collection, harmonized systems, and real-time access to trade records can significantly strengthen the implementation of CITES and national legislation. Improved monitoring capacity can support not only customs and wildlife authorities but also law enforcement and prosecutors in detecting, investigating, and successfully prosecuting wildlife crime.",
      "Start": "17:15",
      "Type": [
        "Side event"
      ],
      "Start date - Panamanian date": "27/11/2025",
      "Start time - Panamanian Time": "17:15",
      "Last Modified": "2025-11-07T15:23:02.000Z"
    },
    {
      "id": "recobAJ22ETgkJ5L5",
      "createdTime": "2025-10-31T16:08:42.000Z",
      "Title": "Committee I",
      "Room ": "Argali (Com I)",
      "start date": "28/11/2025",
      "Start Time - sort": "2025-11-28T13:00:00.000Z",
      "End": "17:00",
      "Start": "14:00",
      "Type": [
        "Main mtg"
      ],
      "Start date - Panamanian date": "28/11/2025",
      "Start time - Panamanian Time": "14:00",
      "Last Modified": "2025-10-31T16:21:27.000Z"
    },
    {
      "id": "recopWZyAEPkXBg2l",
      "createdTime": "2025-11-14T12:50:15.000Z",
      "Title": "Bureau Meeting ",
      "Organizer/Chair": "CoP20 Bureau",
      "Room ": "L. Orchid",
      "start date": "24/11/2025",
      "Start Time - sort": "2025-11-24T16:00:00.000Z",
      "End": "17:30",
      "Start": "17:00",
      "Type": [
        "Other"
      ],
      "Start date - Panamanian date": "24/11/2025",
      "Start time - Panamanian Time": "17:00",
      "Last Modified": "2025-11-14T17:11:02.000Z"
    },
    {
      "id": "recouRS016or51q8X",
      "createdTime": "2025-10-07T15:23:06.000Z",
      "Title": "Sustainable Use of CEAS",
      "Organizer/Chair": "Southeast Asian Fisheries Development Center",
      "Room ": "C.A.Tortoise (40)",
      "start date": "24/11/2025",
      "Start Time - sort": "2025-11-24T12:00:00.000Z",
      "End": "14:30",
      "Description of the side event": "This Side Event will showcase SEAFDEC’s initiatives and highlight regional collaboration in the management and conservation of Commercially Exploited Aquatic Species (CEAS), particularly those subject to proposed CITES listings such as sharks, rays, and tropical eels. ",
      "Start": "13:00",
      "Type": [
        "Side event"
      ],
      "Start date - Panamanian date": "24/11/2025",
      "Start time - Panamanian Time": "13:00",
      "Last Modified": "2025-11-12T11:50:00.000Z"
    },
    {
      "id": "recpCQonbZjV0w8er",
      "createdTime": "2025-10-07T15:23:06.000Z",
      "Title": "National Environmental Atlas",
      "Organizer/Chair": "UNEP Subregional Office in Almaty",
      "Room ": "Caracal (Press)",
      "start date": "25/11/2025",
      "Start Time - sort": "2025-11-25T14:00:00.000Z",
      "End": "16:00",
      "Description of the side event": "National Environmental Atlas presentation",
      "Start": "15:00",
      "Type": [
        "Side event"
      ],
      "Start date - Panamanian date": "25/11/2025",
      "Start time - Panamanian Time": "15:00",
      "Last Modified": "2025-11-11T22:12:55.000Z"
    },
    {
      "id": "recpOQPAvyuVPtfH3",
      "createdTime": "2025-10-31T09:29:35.000Z",
      "Title": "Plenary - ",
      "Room ": "Argali (Com I)",
      "start date": "24/11/2025",
      "Start Time - sort": "2025-11-24T08:30:00.000Z",
      "End": "13:00",
      "Start": "09:30",
      "Type": [
        "Main mtg"
      ],
      "Start date - Panamanian date": "24/11/2025",
      "Start time - Panamanian Time": "09:30",
      "Last Modified": "2025-11-17T09:34:57.000Z"
    },
    {
      "id": "recpUmS65lKhFNIsv",
      "createdTime": "2025-10-07T15:23:06.000Z",
      "Title": "Presentation of Ramsar National Strategy of Uzbekistan The importance of Ramsar sites for biodiversity and migratory species",
      "Organizer/Chair": "GIZ-Uzbekistan Ministry of Ecology, Environmental Protection and Climate Change of the Republic of Uzbekistan Michael Succow Foundation (MSF)",
      "Room ": "Caracal (Press)",
      "start date": "25/11/2025",
      "Start Time - sort": "2025-11-25T17:00:00.000Z",
      "End": "19:00",
      "Description of the side event": "Presentation of Ramsar National Strategy of Uzbekistan The importance of Ramsar sites for biodiversity and migratory species ",
      "Start": "18:00",
      "Type": [
        "Side event"
      ],
      "Start date - Panamanian date": "25/11/2025",
      "Start time - Panamanian Time": "18:00",
      "Last Modified": "2025-11-07T15:25:48.000Z"
    },
    {
      "id": "recpYqPimBGJyB1K9",
      "createdTime": "2025-10-31T16:10:17.000Z",
      "Title": "Committee II",
      "Room ": "Rhodiola S. (Com II)",
      "start date": "3/12/2025",
      "Start Time - sort": "2025-12-03T13:00:00.000Z",
      "End": "17:00",
      "Start": "14:00",
      "Type": [
        "Main mtg"
      ],
      "Start date - Panamanian date": "3/12/2025",
      "Start time - Panamanian Time": "14:00",
      "Last Modified": "2025-11-01T16:31:43.000Z"
    },
    {
      "id": "recqDf9XqAXidbiWf",
      "createdTime": "2025-10-07T15:23:06.000Z",
      "Title": "Eel-Legal Trade",
      "Organizer/Chair": "Sustainable Eel Group",
      "Room ": "Markhor S. (70)",
      "start date": "26/11/2025",
      "Start Time - sort": "2025-11-26T11:15:00.000Z",
      "End": "13:45",
      "Description of the side event": "Examine the challenges this brings to conservation, trade and enforcement around the world. ",
      "Start": "12:15",
      "Type": [
        "Side event"
      ],
      "Start date - Panamanian date": "26/11/2025",
      "Start time - Panamanian Time": "12:15",
      "Last Modified": "2025-11-07T15:25:48.000Z"
    },
    {
      "id": "recqGuolPGiRHbF0f",
      "createdTime": "2025-10-31T16:09:36.000Z",
      "Title": "Committee I",
      "Room ": "Argali (Com I)",
      "start date": "2/12/2025",
      "Start Time - sort": "2025-12-02T13:00:00.000Z",
      "End": "17:00",
      "Start": "14:00",
      "Type": [
        "Main mtg"
      ],
      "Start date - Panamanian date": "2/12/2025",
      "Start time - Panamanian Time": "14:00",
      "Last Modified": "2025-10-31T16:21:35.000Z"
    },
    {
      "id": "recqH85HST0Cipzfn",
      "createdTime": "2025-11-17T11:14:07.000Z",
      "Title": "Plenary - ",
      "Room ": "Argali (Com I)",
      "start date": "4/12/2025",
      "Start Time - sort": "2025-12-04T08:00:00.000Z",
      "End": "12:00",
      "Start": "09:00",
      "Type": [
        "Main mtg"
      ],
      "Start date - Panamanian date": "4/12/2025",
      "Start time - Panamanian Time": "09:00",
      "Last Modified": "2025-11-17T11:14:36.000Z"
    },
    {
      "id": "recqZ9Q4blNqtLAck",
      "createdTime": "2025-10-07T15:23:06.000Z",
      "Title": "CMS, CITES and Sharks ",
      "Organizer/Chair": "Convention on the Conservation of Migratory Species (with GERMANY and Sharks MOU Advisory Committee)",
      "Room ": "S.Falcon (70)",
      "start date": "29/11/2025",
      "Start Time - sort": "2025-11-29T16:15:00.000Z",
      "End": "18:45",
      "Description of the side event": "Highlight how CITES and CMS can jointly strengthen shark and ray conservation, which are essential for healthy marine ecosystems and sustainable fisheries. It will promote dialogue among Parties, stakeholders, and experts to identify practical steps to strengthen cooperation at both the Secretariat and national levels. ",
      "Start": "17:15",
      "Type": [
        "Side event"
      ],
      "Start date - Panamanian date": "29/11/2025",
      "Start time - Panamanian Time": "17:15",
      "Last Modified": "2025-11-07T15:25:48.000Z"
    },
    {
      "id": "recr2VN4TariUE6tK",
      "createdTime": "2025-10-31T16:09:32.000Z",
      "Title": "Committee I",
      "Room ": "Argali (Com I)",
      "start date": "2/12/2025",
      "Start Time - sort": "2025-12-02T08:00:00.000Z",
      "End": "12:00",
      "Start": "09:00",
      "Type": [
        "Main mtg"
      ],
      "Start date - Panamanian date": "2/12/2025",
      "Start time - Panamanian Time": "09:00",
      "Last Modified": "2025-10-31T16:21:34.000Z"
    },
    {
      "id": "recrbRClAq5UODF6E",
      "createdTime": "2025-11-12T14:29:23.000Z",
      "Title": "WG TEST",
      "Organizer/Chair": "Chair/Canada",
      "Room ": "D. Monitor (32)",
      "start date": "26/11/2025",
      "Start Time - sort": "2025-11-26T07:00:00.000Z",
      "End": "09:00",
      "Start": "08:00",
      "Type": [
        "WG"
      ],
      "Start date - Panamanian date": "26/11/2025",
      "Start time - Panamanian Time": "08:00",
      "Last Modified": "2025-11-13T09:23:24.000Z"
    },
    {
      "id": "recsHaGSkcaOBNrUu",
      "createdTime": "2025-10-07T15:23:06.000Z",
      "Title": "Sustainable MAPs trade: Healing Plants, Healthy Trade through Strengthening CITES Implementation for Medicinal and Aromatic Plants",
      "Organizer/Chair": "TRAFFIC International. Event co-hosted with IUCN Medicinal Plant Specialist Group, UK CITES SA for Flora, Nepal CITES SA ",
      "Room ": "Markhor S. (70)",
      "start date": "3/12/2025",
      "Start Time - sort": "2025-12-03T11:15:00.000Z",
      "End": "13:45",
      "Description of the side event": "Provide a platform for Parties and stakeholders to explore progress and next steps in implementing CoP19 Decisions 19.261–264, which call for enhanced capacity building, information exchange, and regional cooperation in the regulation of MAP trade.  ",
      "Start": "12:15",
      "Type": [
        "Side event"
      ],
      "Start date - Panamanian date": "3/12/2025",
      "Start time - Panamanian Time": "12:15",
      "Last Modified": "2025-11-07T19:18:29.000Z"
    },
    {
      "id": "recsj3A5y80ankbUs",
      "createdTime": "2025-11-14T17:12:56.000Z",
      "Title": "Bureau Meeting",
      "Organizer/Chair": "CoP20 Bureau",
      "Room ": "L. Orchid",
      "start date": "3/12/2025",
      "Start Time - sort": "2025-12-03T16:00:00.000Z",
      "End": "17:30",
      "Start": "17:00",
      "Type": [
        "Other"
      ],
      "Start date - Panamanian date": "3/12/2025",
      "Start time - Panamanian Time": "17:00",
      "Last Modified": "2025-11-14T17:13:05.000Z"
    },
    {
      "id": "rectcF773AwW4k3AX",
      "createdTime": "2025-10-29T14:20:41.000Z",
      "Title": "CITES Music Instruments",
      "Organizer/Chair": "League of American Orchestras, co-hosted by the International Alliance of Violin and Bow Makers",
      "Room ": "Markhor S. (70)",
      "start date": "4/12/2025",
      "Start Time - sort": "2025-12-04T16:15:00.000Z",
      "End": "18:45",
      "Description of the side event": "Provide background on the historic and ongoing use of musical instruments and the instrument-making process as it relates to CoP20 agenda items. ",
      "Start": "17:15",
      "Type": [
        "Side event"
      ],
      "Start date - Panamanian date": "4/12/2025",
      "Start time - Panamanian Time": "17:15",
      "Last Modified": "2025-11-07T15:25:48.000Z"
    },
    {
      "id": "recuChLwohZMtypw0",
      "createdTime": "2025-10-07T15:23:06.000Z",
      "Title": "Driving Collaborative Solutions: CITES’ Role in One Health and Convergence Challenges ",
      "Organizer/Chair": "FOUR PAWS International\nCo-host: The Donkey Sanctuary",
      "Room ": "Bukahra D. (120)",
      "start date": "3/12/2025",
      "Start Time - sort": "2025-12-03T18:00:00.000Z",
      "End": "20:30",
      "Description of the side event": "Examine the systemic misuse of CITES Purpose Code “Z”, which is increasingly used to facilitate commercial trade in Appendix I species under the pretext of non-commercial purposes such as conservation or zoological exchange. ",
      "Start": "19:00",
      "Type": [
        "Side event"
      ],
      "Start date - Panamanian date": "3/12/2025",
      "Start time - Panamanian Time": "19:00",
      "Last Modified": "2025-11-07T15:24:39.000Z"
    },
    {
      "id": "recuN5H3UoQs2p0zk",
      "createdTime": "2025-10-07T15:23:06.000Z",
      "Title": "IUCN Red List and CITES",
      "Organizer/Chair": "IUCN  ",
      "Room ": "Markhor S. (70)",
      "start date": "2/12/2025",
      "Start Time - sort": "2025-12-02T11:15:00.000Z",
      "End": "13:45",
      "Description of the side event": "Highlight how the Red List informs and enhances CITES processes and detail important updates to the Red List since CoP19, including the reassessment of all amphibian species in 2023 and the global freshwater assessment in 2024. ",
      "Start": "12:15",
      "Type": [
        "Side event"
      ],
      "Start date - Panamanian date": "2/12/2025",
      "Start time - Panamanian Time": "12:15",
      "Last Modified": "2025-11-07T15:25:48.000Z"
    },
    {
      "id": "recuarnwYjo3EYIGZ",
      "createdTime": "2025-10-07T15:23:06.000Z",
      "Title": "Legal Acquisition Findings",
      "Organizer/Chair": "CITES Secretariat and FAO",
      "Room ": "Markhor S. (70)",
      "start date": "26/11/2025",
      "Start Time - sort": "2025-11-26T16:15:00.000Z",
      "End": "18:45",
      "Description of the side event": "Examine the challenges and best practices for the making of legal acquisition findings, and their central role in conservation, trade and enforcement around the world. ",
      "Start": "17:15",
      "Type": [
        "Side event"
      ],
      "Start date - Panamanian date": "26/11/2025",
      "Start time - Panamanian Time": "17:15",
      "Last Modified": "2025-11-07T15:24:39.000Z"
    },
    {
      "id": "recvL9C1ldZlsrEe1",
      "createdTime": "2025-10-31T16:07:12.000Z",
      "Title": "Committee I",
      "Room ": "Argali (Com I)",
      "start date": "26/11/2025",
      "Start Time - sort": "2025-11-26T08:00:00.000Z",
      "End": "12:00",
      "Start": "09:00",
      "Type": [
        "Main mtg"
      ],
      "Start date - Panamanian date": "26/11/2025",
      "Start time - Panamanian Time": "09:00",
      "Last Modified": "2025-10-31T16:21:14.000Z"
    },
    {
      "id": "recvcQxcm6x6hpZLg",
      "createdTime": "2025-10-07T15:23:06.000Z",
      "Title": "CITES and Local Voices",
      "Organizer/Chair": "BirdLife International, in collaboration with the governments of Indonesia and the Philippines, and Mandai Nature",
      "Room ": "C.A.Tortoise (40)",
      "start date": "29/11/2025",
      "Start Time - sort": "2025-11-29T16:15:00.000Z",
      "End": "18:45",
      "Description of the side event": "The session aims to inspire more inclusive, community-driven approaches that amplify community voices and strengthen local confidence and capacity to deliver long-term, positive outcomes for the conservation of internationally traded species and effective implementation of CITES commitments on the ground. ",
      "Start": "17:15",
      "Type": [
        "Side event"
      ],
      "Start date - Panamanian date": "29/11/2025",
      "Start time - Panamanian Time": "17:15",
      "Last Modified": "2025-11-07T15:25:48.000Z"
    },
    {
      "id": "recw0D9TJU9jApWig",
      "createdTime": "2025-10-07T15:23:06.000Z",
      "Title": "eCITES Permit System",
      "Organizer/Chair": "CITES Secretariat",
      "Room ": "Saiga A. (120)",
      "start date": "3/12/2025",
      "Start Time - sort": "2025-12-03T16:15:00.000Z",
      "End": "18:45",
      "Description of the side event": "This side event will provide a platform for Parties, experts, and stakeholders to explore strategic approaches to fully implement eCITES systems in line with relevant CITES Resolutions and Decisions. ",
      "Start": "17:15",
      "Type": [
        "Side event"
      ],
      "Start date - Panamanian date": "3/12/2025",
      "Start time - Panamanian Time": "17:15",
      "Last Modified": "2025-11-07T15:25:48.000Z"
    },
    {
      "id": "recwZcvsnpCIQ6vMZ",
      "createdTime": "2025-10-07T15:23:06.000Z",
      "Title": "Sea Cucumber Trade",
      "Organizer/Chair": "Center for Biological Diversity",
      "Room ": "Manul (40)",
      "start date": "25/11/2025",
      "Start Time - sort": "2025-11-25T11:15:00.000Z",
      "End": "13:45",
      "Description of the side event": "Examine these implementation experiences, highlighting available tools, enduring challenges, and lessons learned, and will explore how they can inform forthcoming proposals.  ",
      "Start": "12:15",
      "Type": [
        "Side event"
      ],
      "Start date - Panamanian date": "25/11/2025",
      "Start time - Panamanian Time": "12:15",
      "Last Modified": "2025-11-07T15:25:48.000Z"
    },
    {
      "id": "recx6ughdWMbeeWzS",
      "createdTime": "2025-10-07T15:23:06.000Z",
      "Title": "CITES e-learning tools",
      "Organizer/Chair": "CITES Secretariat",
      "Room ": "Saiga A. (120)",
      "start date": "27/11/2025",
      "Start Time - sort": "2025-11-27T16:15:00.000Z",
      "End": "18:45",
      "Description of the side event": "\"This side event will highlight an array of digital tools and online learning opportunities available to Parties and the general public. As the world continues to shift online, it is vital that multilateral environmental agreements like CITES tap into new resources to encourage learning and development. \n\nOn the occasion of the 20th Meeting of the Conference of the Parties, the CITES Secretariat will be launching the brand new CITES E-learning course, where users can learn about the Convention and different themes that are key for implementing CITES, including:\nCITES Authorities\nRegulation & exemptions\nReporting requirements\nNon-detriment findings and export quotas\nLegal Acquisition Findings\nReview of Significant Trade\nCompliance procedures\nTransport of Live Specimens\n\nThe interactive course is free and open to the public, and users receive a certificate upon completion. \n\nThe event will also walk through different online platforms, such as the UNEP InforMEA Initiative, to showcase resources for Parties, such as a collection of national reports, the Negotiator’s Toolkit, and the new Global Goals page. This will demonstrate different tools that can be used during the CoP, throughout the reporting process, and when developing plans to harmonize CITES implementation and the UN Sustainable Development Goals.\n\nThe side event aims to help participants learn more about the resources available to them and how they can use digital tools to enhance their work on CITES.\"",
      "Start": "17:15",
      "Type": [
        "Side event"
      ],
      "Start date - Panamanian date": "27/11/2025",
      "Start time - Panamanian Time": "17:15",
      "Last Modified": "2025-11-07T15:23:02.000Z"
    },
    {
      "id": "recxGvwZ4l3qsW05P",
      "createdTime": "2025-10-31T16:10:13.000Z",
      "Title": "Committee I",
      "Room ": "Argali (Com I)",
      "start date": "3/12/2025",
      "Start Time - sort": "2025-12-03T08:00:00.000Z",
      "End": "12:00",
      "Start": "09:00",
      "Type": [
        "Main mtg"
      ],
      "Start date - Panamanian date": "3/12/2025",
      "Start time - Panamanian Time": "09:00",
      "Last Modified": "2025-10-31T16:21:41.000Z"
    },
    {
      "id": "recxnoq84GynyZK6x",
      "createdTime": "2025-11-14T17:11:33.000Z",
      "Title": "Bureau Meeting\n",
      "Organizer/Chair": "CoP20 Bureau",
      "Room ": "L. Orchid",
      "start date": "26/11/2025",
      "Start Time - sort": "2025-11-26T16:00:00.000Z",
      "End": "17:30",
      "Start": "17:00",
      "Type": [
        "Other"
      ],
      "Start date - Panamanian date": "26/11/2025",
      "Start time - Panamanian Time": "17:00",
      "Last Modified": "2025-11-14T17:11:46.000Z"
    },
    {
      "id": "recyIDByk6V9XzGHX",
      "createdTime": "2025-10-31T16:08:42.000Z",
      "Title": "Committee II",
      "Room ": "Rhodiola S. (Com II)",
      "start date": "28/11/2025",
      "Start Time - sort": "2025-11-28T08:00:00.000Z",
      "End": "12:00",
      "Start": "09:00",
      "Type": [
        "Main mtg"
      ],
      "Start date - Panamanian date": "28/11/2025",
      "Start time - Panamanian Time": "09:00",
      "Last Modified": "2025-10-31T16:21:57.000Z"
    },
    {
      "id": "reczgqarqniHqcmko",
      "createdTime": "2025-10-07T15:23:06.000Z",
      "Title": "Whale sharks & friends",
      "Organizer/Chair": "Maldives",
      "Room ": "Bukahra D. (120)",
      "start date": "28/11/2025",
      "Start Time - sort": "2025-11-28T16:15:00.000Z",
      "End": "18:45",
      "Description of the side event": "Provide a snapshot of the key role these species play in the Maldives by supporting sustainable tourism livelihoods, along with the science supporting the listings, the anticipated benefits of this uplisting, and the enforcement mechanisms needed for success.  ",
      "Start": "17:15",
      "Type": [
        "Side event"
      ],
      "Start date - Panamanian date": "28/11/2025",
      "Start time - Panamanian Time": "17:15",
      "Last Modified": "2025-11-07T15:24:39.000Z"
    },
    {
      "id": "reczlpoMQ4tVMhzml",
      "createdTime": "2025-10-07T15:23:06.000Z",
      "Title": "Leopard: Forgotten Cats",
      "Organizer/Chair": "Environmental Investigation Agency co-hosted\n with Panthera",
      "Room ": "G.Bustard (40)",
      "start date": "24/11/2025",
      "Start Time - sort": "2025-11-24T12:00:00.000Z",
      "End": "14:30",
      "Description of the side event": "This side event will shine a spotlight on leopards, and why this widespread but heavily persecuted species is at risk of “disappearing in silence.” It will cover assessments showing a severe reduction in their population and range in South-East Asia; legal domestic markets for leopard products in Asia; the scale and nature of illegal trade in leopards as seen through seizures, prosecutions and trade observations. ",
      "Start": "13:00",
      "Type": [
        "Side event"
      ],
      "Start date - Panamanian date": "24/11/2025",
      "Start time - Panamanian Time": "13:00",
      "Last Modified": "2025-11-12T11:50:02.000Z"
    }
  ]
}